isim,tel,adres
Bilburrey Restaurant,5132550,"Nöbethane Cad. Kargılı Sok. Hotel Prince No:5 Sirkeci, Fatih"
Plaza Restaurant,+90 212 370 20 20,Plaza Otelin Birinci Katı
Kebapçı Çetin Usta,0 212 864 08 09 ,Batıköy Mah. Mustafa Kemal Bulv. Kalikratya Evleri A Blok
Franz Kafka Cafe,+90 216 450 2009,"Albay Faik Sözdener Cad. Damga Sok. No:23 Kadıköy, Istanbul"
Carsi Restaurant,5433399,Cevizlik Mah. Hamam Sok. No:10
Gizli Bahce Restoran,3677231,Tokatkoy
Kale Restaurant,395 2693,Postahane Mah. Cumhuriyet Cad. No.38 Istasyon
Altın Nokta,3667887,Altın Tepe Mah. Bağdat Cad. Sibel Apt. No:44 D:1 Maltepe
Mavi Kosk Sac Tava,6294559,Yuzyil Mah. Barbaros Cad. 11. Sok. No:31
Anatolia Durum & Kebap,5275551,Cekmekoy Yolu Hamza Yerlikaya Bulv. No:16/A
Namli Durum,6318009,Sariguzel Cad. No:57/B
Tuzla Comlek Pide & Kebap,4461803,Kazim Karabekir Cad. Hayat Sitesi O Blok No:1/A
Sümerhan Lokantası & Cafe Ala,5271084,Hobyar Mah. Büyük Postane Cad. No:74 Fatih
Garden Izgara,"
",Karanfil caddesi hanımeli sokak no 5
Quzco Brasserie,5322406499,Maslak Mh. Akasya Sk. No:2 Mashattan Bloklari T. 104 Maslak/Sariyer
Bab-ı Ali Cafe Bar,902122444556,Istiklal Caddesi Mis Sokak No : 15/1
Kardesler Bufe,5224814,Tacirhane Cad. No:10
Kivilcim Ev Yemekleri,5501268,Visne Sok. No:3
Domino's Pizza,5602145,4. Kisim Carsisi D:17
Misina Balık Restoran,+90 216 550 0258,Dr. Faruk Ayanoğlu Caddesi No: 36/A
Biber Cafe-Restaurant,3267414,Muhittin Ustundag Cad. No:75
Aperativo,2924400,Meşrutiyet Cad. Orhan Adli Apaydın Sk. 17
Crepe & Fondue,351 4951,Zeytinoglu Cad. No. 3 Akatlar
Seos Cafe & Restaurant,511 9055,Makascilar Cad. No.48 D 50 Beyazit
Rumeli Restaurant,5077373,Nazim Erten Sok. The Green Park Merter No:13
Yılmazlar Lokantası,5212947,Kara Sarıklı Sok. No:8 Fatih
Tuzla Eats Restaurant&Cafe&Bar,2164467070,Postahane Mah Manastiryolu Cad 8 Tuzla
Kervansaray,212 247 16 30,"Cumhuriyet Cad. Kervansaray Apt. No:52/A K:Giriş Harbiye, Şişli"
Lale Restaurant,"
",Fethi Bey Cad. Crowne Plaza Istanbul No:10
Bursa Izgara,5427592,Ebuziya Cad. No:10 D:1
Yildiz Yakamoz,4636210,Alt Gecit Carsisi No:42-43
Pide kral,02123510867,Zeytinoglu cad Selcuklar sk. No: 11
Çıtır Usta,6851199,Osmanlı Bulv. World Atlantis Alışveriş Merkezi No:117 K:3
Zeytinli Restoran,"
",Asmalimescit Sk. No:33 Tunel - Beyoglu
Kilisli,(0212) 522 65 25,Mollafenari Mah. Nuruosmaniye Cad.
Fratelli la Bufala,0212/3479900,"Trump Towers, Sehit Ahmet Sok. 1"
Yer Cafe,0216 4501670,Moda Caddesi 262
Cafe Wien,02122337860,Reasurans Pasaji no:62 Tesvikiye
Antioch,4782337,Plaj Yolu Sok. Tumay Apt. No:3/A
Kitchenette - Capitol AVM,"
",Mahir Iz Caddesi Capitol AVM 3. Kat 114-117 Altunizade
Casita MantI,+90 212 263 70 07,Nispetiye Cad. No: 5 Etiler
Taximus Cafe & Restaurant,3614067,Talimhane Mevki Aydede Cad. No:4 K:2 D:1 Beyoğlu
Gaziantepli Kose Basi Durum Evi,5757319,Sonbahar Sok. Sen Apt. No:54
Roof Restaurant,370 2020,Balmumcu Mah. Barbaros Bulv. The Plaza Hotel No.165 Gayrettepe
Törek Mantı,90-216-347-1875,"Dr.Esat Isik Cad.21, Moda"
Titanic Roof Restaurant,4137000,Fisekhane Cad. Titanic Port Otel No:7 D:3
Ozkan Koftecisi,5201325,Uzun Carsi Cad. No:317
Mesut Usta,02124891617,"Gunesli, Evren Mahallesi Gulbahar Cad. N 55 Bagcilar"
Casita Plus,3851126,Kosk Sok. No:4 D:3
KFC,"
",Derekoy Mevki Suzer Bulv. 3. Cad. Sehr-i Bazaar Alisveris Merkezi D:12
Ayazma Aile Cay Bahcesi,3772051,Abdurrahmangazi Mah. Ayazma Cad. No:72
Burger King,2991831,"Tarabya Mah. Haydar Aliyev Cad. Haydar Bey Apt. No:170 D:1 Tarabya, Sarıyer"
Eminonu Bufe,5120175,Savurgan Cad. No:80
Rodop Köftecisi,4410810,"Bağdat Cad. No:274 Feyzullah, Maltepe"
Köşem Karadeniz Pide,3601678,İstasyon Cad. No:10 D:5 Kadıköy
The Garden Restaurant - Cafe,5378670,Haci Muhittin Sok. No:40
Koclar Sofrasi,5303718,Cumhuriyet Cad. Aktas Apt. No:46
Erzurum Cağ Kebap,3132525,Alemdağ Cad. No:205 Ümraniye Merkez
Kaburga Sofrasi,2259595,Halaskargazi Cad. No:142 D:4
Antepli Üstad'ım,5721398,"Karslı Ahmet Cad. No:44 D:1 İçerenköy, Ataşehir"
Mirror Dilli Cafe,4378686,Otakcilar Cad. Flatofis No:78 K:1
Dilek,6400315,Kocatepe Mah. Şehir Parkı Cad. Forum İstanbul K:1 D:97 Bayrampaşa
Nazar Restoran,5036667,"Zafer Mah. Yahya Kemal Sok. No:1 Yenibosna, Bahçelievler"
Koyevi Restaurant,4323238,Cumhuriyet Cad. Yavuz Sok.
Titiz Turkish Pizza,5188323,Mollatasi Cad. No:59/A
Alp Karadeniz Pidecisi,5727646,Hatboyu Cad. No:10 D:1 Bakırköy Merkez
Sirin Cafe,"
",Galata Kule Sk. No 2
Dostlar Kebap Salonu,6530090,Yildirim Beyazit Cad. Turkistan Sok. No:3
G By Karaf,90-(212) 327 07 07,Suada Club-Galatasaray AdasI
Kavacik Marmaris Bufe,4254307,Ruzgarlibahce Mah. Cumhuriyet Cad. No:63/A
Cookshop,6632100,"Barbaros Mah. Halk Cad. Palladium Alışveriş Merkezi No:8 K:1 D:132 Yeni Sahra, Ataşehir"
Burger King,5911048,Marmara Cad. No:15
Comlek,3351434,Kisikli Mah. Turistik Camlica Cad. No:50
Kuruçeşme Balık,+90 212 263 44 72,Kuruçeşme Cd. No:9 Galatasaray Adası Karşısı
Tokana Manti,3869136,Bagdat Cad. Yapi Kredi Bloklari No:363/B
Ziya Şark Sofrası,5717021,Halit Ziya Uşaklıgil Cad. Carousel Alışveriş ve Yaşam Merkezi No:1 K:2 D:12 Bakırköy Merkez
The Han Restaurant,(0212)5266262,"Cankurtaran Mah, Alemdar Cd. Soguk Cesme Sk. No. 26"
Şar Lokantası,4589219,Yeniçeriler Cad. No:47 Fatih
Domino's Pizza,5224000,Hobyar Mah. Ankara Cad. Nurlu Merkez Hanı No:123/A
Sohbet Ocakbaşı Restaurant,2441652,Mis Sok. No:3 D:5 Beyoğlu
Paşalimanı Kafe,0216 413 92 53,Cubuklu Hidiv Yolu No:32
Eftelya Restaurant,0212-2872520,Arnavutköy Mah. 1. Cad No:32 Arnavutköy - Beşiktaş
Fıstık Kebap,2585149,"Büyük Şekerci Sok. No:4 Ortaköy, Beşiktaş"
Meşhur Mahmutbey Kanatçısı,3601801,"İnönü Cad. No:53 D:1 Erenköy, Kadıköy"
Ronepark Cay Bahcesi,6628856,Istanbul Cad. No:62
Cumhuriyet Meyhanesi,0212 293 1977,"Hüseyinağa Mh., Sahne Sokak No:47"
Dem Bebek,+(90)2122879773,Bebek Mah. Selçuk Sok. No:7 Beşiktaş
Nurzade Ev Yemekleri,2179017,Ortaklar Cad. Bahceler Sok. No:8
Sultanahmet Köftecisi Grill,2672080,Yıldızposta Cad. No:52 D:18 Beşiktaş
Teras6,2459798,Mesrutiyet cad 61 K6
Num Num Cafe&Restaurant,02123530708,Eski Buyukdere Cad. No: 185-175 Levent
Feraset,0216 567 42 42,Mervivenköy Mh. Fahrettin Kerim Gökay Cad.No: 197/1-2
Hacıoğlu,2510364,"Gümüşsuyu Mah. Cumhuriyet Cad. Taksim Gezi Dükkanları D:6 Taksim, Beyoğlu"
Midpoint,6610874,Zeytinlik Mah. Fişekhane Cad. Capacity Alışveriş Merkezi No: 62 Ze02 Bakırköy
Meshur Halk Koftecisi,0212 2938544,Galip Dede Caddesi 17 Tunel - Beyoglu
Necip Uludag Kebap,3583386,Iskele Cad. No:8/C
Cesta Manti,3571767,Bagdat Cad. No:233/A
Tekne Restaurant,5736564,Camozu Sok. No:11
Van Kahvaltı Evi,2404776,Valikonağı Cad. Sezai Selek Sok. No:19 Şişli
Antik Bufe,4166642,Gokalp Mah. 73. Sok. No:6/B
Burak Steak House Al Madina,+(90)2126513131,6/A Meselik Sokak
Fındık Cafe Restoran,2529424,"Meclisi Mebusan Cad. No:79/B Kabataş, Beyoğlu"
Gigi,+(90)212 3455650,Pinar Mah. Istinye Bayiri Cad. Istinyepark Avm Sariyer
Egeli Gurme,216-315 05 06 / 315 05 10,Ortabahar Cad. No:26
Birecikli Kasap Tava Kebap Lahmacun,2126635563,Senlikkoy Mahallesi Tezgel Sok. No:3/A
Ziya Şark Sofrası,+90 212 531 3003,Fevzipaşa Cad. No:61 Fatih/İstanbul
Hain Kofte,3461151,Ahi Evren Cad. Nazmi Akbaci Is Hani No:103
3 Kamber,"
","Bebek Arnavutkoy Caddesi No:71 Arnavutkoy/Besiktas, Istanbul"
Vera Restaurant,2512291,Sahne Sok. No:40
Galata Altın Balık Restaurant,+ 90 0 212 293 23 46,"Yeni Galata Köprüsü Altı, Karaköy Boğaz Tarafı No: 15"
Domino's Pizza,5279911,Alemdar Mah. Prof. Dr. Ismail Kazim Gurkan Cad. No:3/B
Guverte,663 2880,Istanbul Cad. Sahil Yolu Florya
Çıtır Ocakbaşı,2167075,Fahri Gizden Sok. No:9 D:1 Beşiktaş
Pala Ocakbaşı,+90 212 249 0470,Kamer Hatun Mah. Kamer Hatun Cad. No: 17/2 Balıkpazarı
Çömlek Taş Fırında Kuru Fasülye,6961313,Dede Paşa Cad. Via/Port Outlet AVM No:19 K:-1 D:15
Cafe Benjamin,+(90)216 575 50 10,"Ali Ay Sokak No :6 Atasehir, Istanbul"
Zeynep Cafe,2935155,Mumhane Cad. No:35/A
Haylayf Cafe&Rest,532 230 97 57,Basinkoy Istanbul Cad. Kucukcekmece Plaji Yani
Sushico,6615100,2. Kisim Carsisi No:26/B
Tadiala Doner,2122594748,Mumcu Bakkal Sok. No: 16 Besiktas Istanbul
Oz Sultan Sofrasi,2828393,Celiktepe Mah. Inonu Cad. No:28/A
Yemekchi,3386425,Rihtim Cad. Misaki Milli Sok. No:5 D:1
Meshur Boyabat Kuzu Cevirme,4202671,Uzun Ayna Cad. Leylak Sok. No:18
Dilek,4871501,Başakşehir Mah. Başakşehir 4. Etap İstanbul Çarşısı D:28 Başakşehir
Cafe Boheme,2510932,"İstiklal Cad. Küçük Parmak Kapı Sok. No:11 Taksim, Beyoğlu"
Yeşil Mavi Karadeniz Sofrası,3696039,Şair Arşi Cad. No:43/A Kadıköy
Domino's Pizza,4933333,Nisanca Mah. Eyup Sultan Bulv. No:66 D:5
Altıyol Boğa Cafe,3374549,Osman Ağa Mah. Halitağa Cad. No:1 Kadıköy
Sanayi Lokantasi,(0212) 328 0468,"Ataturk Oto Sanayi Sitesi 2. Kisim 26. Sokak Maslak, Istanbul, Turkey"
327 Hindi,2160782,Cemal Sahir Cad. Profilo Alışveriş Merkezi No:33 K:3 D:26
Popup,2962001,Harbiye Mah. Kadırgalar Cad. No:3
Bolulu Hasan Usta Süt Tatlıları,4370823,Kocatepe Mah. Şehir Parkı Cad. Forum İstanbul K: Bayrampaşa
Aslı Balık Evi,02163851993,Göztepe Mah. 1. Orta Sok. No:33/B
Urfa Sofrasi,5878222,Seyit Omer Mah. Alti Mermer Cad. Hasan Kazim Bey Sok. No:8
istanbul jazz center jc's,"
",CIragan Caddesi Salhane Sk
Burger King,3857575,Cemil Topuzlu Cad. Ciftehavuzlar Sok.
Cajun Cafe Brasserie,2529600,Sıraselviler Cad. Innpera Hotel No:15 K:Zemin Beyoğlu
Ağva Gizlibahçe Restaurant, 0 216 7217223,Sazgeyin Mevkii Köprü Yanı No:1
Ari Antik Restaurant,2439575,Yeni Galata Koprusu No:KH2
Mercan Kokoreççisi,2193258,Vatan Cad. No:1 Şişli Merkez
Kimyon Durum,3304845,Kadife Sok. No:17/C
Yeni Pelit,90 216 3663502,Bagdat Cad. Kasaplar CarsIsI 2/A
Celtik Kebap ve Lahmacun,3526126,Bagdat Cad. No:370/A
celebi Kebap Lahmacun,+902122504698,"Talimhane, Sehit Muhtar Cad."
Adanali Hasan Kolcu,(0216) 573 89 89,Ahmet Yesevi Cad. No 7/B Sky Towers Karsisi
McDonald's,4747777,Evren Mah. Kocman Cad. No:40
Doga Pastanesi,2163060206,"Karliktepe Mahallesi, Egemenlik Bulvari, No:47/A Kartal / Istanbul"
Mesta Sandwiches & Treats,251 0488,Akarsu Cad. Anahtar Sok. No. 3
McDonald's,5202120,Hobyar Mah. Ankara Cad. No:209
Numnum,3586600,Bagdat Cad. No:339/A
Seyru Sefa Cafe,5182144,"Yeniçeriler Cad. Kardaşlar Apt. No:2 Çemberlitaş, Fatih"
Kumkapı Meydan Balık Restoran,6388462,Üsdat Sok. No:17
Burger King Marinturk Pendik,2165114060,Bati Mah Sahil yolu cad Ido yani Marinturk Pendik Marina C01 Pendik
Deep Fish Restaurant,+(90)212 777 55 31,"IstWest , Değirmenbahçe Cd, No . 17A1 / 25-26, Yenibosna"
Baffetto istanbul,02163601207,Yapi Kredi Ikramiye Bloklari 361/a
Cafe Fessa,"
","Ihlamurdere Caddesi, Celebioglu Sok. no 11A, Besiktas"
Ankara Lokantası,5227070,Kömürcü Bekir Sok. No:8 Fatih
Karadeniz Kardeşler Pide & Kebap Salonu,0212 520 80 61 - 62,Divanyolu Caddesi Biçkiyurdu Sokak
Baysan Tat Lokantası,3649281,Çakmak Mah. Tavukçuyolu Cad. No:2 Ümraniye
Bolulu Hasan Usta Süt Tatlıları,3733635,19 Mayıs Mah. Şemsettin Günaltay Cad. Oral Sok. No:118/B Kadıköy
Doydoy Yemek ve Kebap Salonu,2372492,"Emekyemez Mah. Akik Sok. No:1 Şişhane, Beyoğlu"
Hamdi Kofte,0212 5284525,"Rustem Pasa Mahallesi, Tahmis Caddesi, Kalcin Sokak, No 9/B, Fatih, Istanbul"
Bistro Cabana,+(90)216 577 84 84,İnönü mahallesi Kayışdağı caddedi
Tarihi Karakoy BalIkcIsI Grifin,243 4080,Tersane Cad. Kardesim Sk. 30 Kardeşim Sokak No. 45
Kayra Roof Restaurant,2123736666,"Halaskargazi Caddesi No:96 Osmanbey, Sisli, Istanbul"
Bursa Iskender,5723762,Incirli Cad. Ulku Sok. No:5
Fistik Kebap,2635884,1. Cadde 40
Dilim Pizza,5733325,Istanbul Cad. No:58
Cakehouse,902123272800,68 Nuzhetiye Caddesi
Zoe Restaurant,6772121,Ahmet Kutsi Tecer Cad. Zoe Boutique Hotel No:12
Burger King,5704860,Cirpici Yolu
Katerina Restoran,2493262,"Rıhtım Cad. No:17 Karaköy, Beyoğlu"
Zumrut Restaurant,4524156,Carsi Mah. Ayazma Meydani Sekersuyu Sok. No:8
Sampi,5655572,Fahrettin Kerim Gokay Cad. No:186/A
Ana Manti & Gozleme,5730879,Sevketiye Mah. Istasyon Cad. No:59
Change Cafe,212 259 5535,İskele Meydanı No:8 Ortaköy
Kanyon Bufe,6596581,ISTOC Sanayi Sitesi 17. Ada D:125
Site Bufe,4710403,YEDPA Ticaret Merkezi A Cad. D:60
Senlikoy Pidecisi,6633522,Mektep Sok. No:41 D:4
Hanegah,212 523 54 14 ,At Pazari
Brasserie Restaurant,5281865,Gencturk Cad. Sirvanizade Sok. Best Western Senator Otel No:7
Deniz Restaurant,3144242,Halide Edip Adıvar Mah. Darülaceze Cad. Grand Cevahir Hotel No:9 Şişli
Turkish-I Kebap,216 685 1065,"Dumankaya Cadde Sitesi, Cumhuriyet Bulvari No:12 Kurtkoy"
Emporio Armani Suadiye,+(90)2164166565,Suadiye Mahallesi Bağdat Caddesi No:469
Teras Bar Restaurant,2924949,Boğazkesen Cad. Tomtom Kaptan Sok. Tomtom Suites Hotel No:18
Erzincan Kebap,2567311,"Tersane Cad. Hocahanım Sok. No:17 Karaköy, Beyoğlu"
Fresh Fish,5281398,Tahmis Cad. No:7
Ucler Restaurant,4932830,Guzelyali Mah. Egemen Sok.
Meshur Durumcu Memet Usta,2595363,Dereboyu Cad. No:149/A
Feslegen Cafe,4114620,Bagdat Cad. Tanzimat Sok. Kural Apt. No:4
Kirimli Et & Balik,5233433,Fatih Cad. Malta Carsisi D:19
Dalyan Club,3485841,"Atlıhan Sok. No:3 D:5 Fenerbahçe, Kadıköy"
Teppanyaki Alaturka,2122878228,Nispetiye Cad. 107
Taş Fırın Kebap,3731039,Ayşe Çavuş Cad. Aydın Sok. No:13 D:4 Suadiye
Polo Cafe Bistro,4892800,Evren Mah. Gulbahar Cad. 5. Sok. No:76
Namport Cafe & Restaurant,2511541,Rihtim Cad. No:7
Express Restaurant,5225273,"Vidinli Tevfik Paşa Cad. No:38 D:1 Laleli, Fatih"
Sirin Kofte,2786858,Eski Buyukdere Cad. Ergun Sok. No:8
Fatih Belediyesi Yedikule Sosyal Tesisleri,5293620,Hacı Evhaddin Mah. Hacı Evhaddin Cad. No:78 Fatih
Evrim Restaurant,5871005,Kizil Elma Cad. No:22
Balikci Kenan,6699529,Bahcesehir 2. Kisim Mah. Bogazkoy Yolu
McDonald's,4411621,Adnan Kahveci Bulv. No:93
Kofteci Recebim,3544339,Dogu Mah. Lale Sok. No:26
Seyidoğlu Baklava Eminönü,+(90)2125149900,Cicek Pazari Sk. No:20
Bambi Cafe Osmanbey,+90(0)212 2252727,Halaskargazi Caddesi
La Vita E Bella Restaurante,02125173750,Cankurtaran mah.akbıyık cad.no:40 sultanahmet
Blue Restaurant,5301086,Imrahorsalacak Mah. Sahil Yolu No:21
Köfteci Ramiz,2323353,Şişli Merkez Mah. Abide-i Hürriyet Cad. No:129 D:2 Şişli Merkez
Ufuklar Dürümcü Bey,3600360,"Fahrettin Kerim Gökay Cad. No:282 D:1 Sahrayıcedit, Kadıköy"
Burger King,2936453,İstiklal Cad. Fitaş Hanı No:24 D:26 Beyoğlu
Burger Bar,0 212 229 6092,Tuncay Artun Cad. No:133/A
Saraykapı Saç Tava,6762727,Ambarlı Mah. Cumhuriyet Cad. No:15
McDonald's,2938600,"Cumhuriyet Cad. No:5 Taksim, Beyoğlu"
Pasha Nargile,2512293,Şehit Muhtar Mah. Zambak Sok. No:3/A Beyoğlu
Limon Cafe Ev Yemekleri,+(90)212 526 68 06,Hobyar Mahallesi Rahvancı sokak no:1
Develi Pide Salonu,5179372,Mimarhayrettin Mah. Gedikpaşa Cad. Semih Sok. No:6 Fatih
Kirmizi Barbeku,216 417 92 42,"Turgut Ozal Bulvari No: 15, Kucukyali - Maltepe"
All Sports Cafe,+902122474623,Şakayık Sk. No: 67A
Siva Restaurant,2999273,Kefelibaglar Mevki Buyukdere Cad. No:28
Cipriani,3177700,Büyükdere Cad. The İstanbul Edition No:136 Beşiktaş
Sisli Balik Restaurant,212 296 00 06,Halaskargazi street no: 69 istanbul pangaaltı osmanbey
Otto Sofyalı,2526588,Asmalımescit Mah. Sofyalı Sok. No:22/A D:1 Beyoğlu
Istanbul Doner,4952855,Ataturk Mah. Pazar Yolu Cad. No:19
Cities Pera,+(90)0212 292 4400,"Asmalı Mescit Mh., Orhan Adlı Apaydın Sk No:17, 34420 İstanbul"
Adana Yüzevler Kebap,3462171,Ahi Evren Cad. Nazmi Akbacı İş Merkezi No:210 K:Zemin Şişli
The Han Kebap House,5260505,Hocapaşa Mah. Alemdar Cad. No:19 Fatih
Köfteci Ramiz,5244960,Adnan Menderes Bulv. Historia Alışveriş Merkezi No:2 K:3 Fatih
Cafe Leyla,2599619,"Teşvikiye Cad. Göksu Pasajı No:105 D:1 Harbiye, Şişli"
1976 Ozsaray Iskender,+90 216 329 0202,Bulgurlu Cad. No:122/A
Melek Büfe,2937263,Sıra Selviler Cad. No:28 Taksim
Nalia,4699610,İçerenköy Mah. Prof. Dr. Ali Nihat Tarlan Cad. No:103 D:1 Kadıköy
Hisar Iskele,+902122632997,Rumeli Hisari
Luna Piena Balık,2577185,Cevdet Paşa Cad. No:56 Beşiktaş
Beyaz Restaurant,518 3631,Kennedy Cad. Balikcilar Carsisi D 28 Kumkapi
Ali Baba Iskender Kebapcisi,2277728,Ihlamurdere Cad. Sinan Pasa Yeni Hamam Sok. No:13 D:3
Yusuf Usta'nin Yeri,4635136,Emin Ali Pasa Cad. No:65 D:3
Faroz Pide & Akcaabat Kofte Salonu,3067582,Atalar Mah. Uskudar Cad. No:85
Fethi Pasa Konagi,3916560,Pasa Limani Nacak Sok.
Küçük Ev,2829696,"Çarşı Cad. No:5 Levent, Beşiktaş"
Hayat Kahvesi,4928925,Icadiye Cad. No:67
Meyhane,2164493088,"Osmanaga mah. Osmancik Sokak no: 14, Kadikoy"
Hayatoglu Kebap Lahmacun ve Pide Salonu,5745151,Adakale Cad. No:9
Florya Kebap,4264847,Senlik Mah. Cekmece Cad. No:6
Durkan Çorba ve Kebap Salonu,5444657,Nişanca Mah. Otakçılar Cad. No:79
M&N Gür Pizza,4378008,Otakçılar Cad. Flatofis No:78 K:2
Makara Cafe,02122594811,Cihannuma Mah Salih Efendi Sokak no6
Villa Maral,3630203,Göztepe Mah. Tütüncü Mehmet Efendi Cad. No:1 D:1 Kadıköy
Naco's House,2652425,"Arnavutköy Cad. Satış Meydanı Sok. No:23 Arnavutköy, Beşiktaş"
Deli Cafe Restaurant,0216 337 63 33,Hacı Sükrü Sokak
Şampion Kokoreç,"
",Terazidere Mah. Çiftehavuzlar Cd. No: 56
Mustafa,02122490625,Rihtim. Cad. 17 Karakoy
A.V.Ç Büfe,6388465,"Mesih Paşa Mah. Laleli Cad. No:35 D:1 Laleli, Fatih"
Çiçek Izgara,6998755,Saadetdere Mah. 68. Sok. Torium Alışveriş Merkezi No:50 K:3
Beyaz Cafe Et Lokantası,5269688,"Kemal Paşa Mah. Ordu Cad. No:286 Tahtakale, Fatih"
Irmak Iskender,3412020,Valideiatik Mah. Zeynep Kamil Sok. No:14/A
Sirin Iskender Kebap,2305991,Vali Konagi Cad. Madalyon Sok. No:5/A
Sungurlular,2608141,Ihlamurdere Cad. Sehit Dursun Bakan Sok. No:11
Veranda Grill & Bar,+90 3156000,Cumhuriyet Cad. Hilton Istanbul Harbiye
Gunaydin,4474794,Postahane Mah. Manastir Yolu No:24
Mehmet Sait Restaurant,2122831304,Buyukdere Cd. Levent Mh. Comert Sk. No. 2DB/1 Levet
Sahan Suadiye, (216) 373 29 39 ,Bagdat Cad. No:461 Suadiye
Molka Cafe,0212 299 2255 ,Köybaşı Cad. No:158/B
Bizce Kuru,2360621,Dereboyu Cad. No:52 Beşiktaş
Konyali Restaurant,513 9696,"Topkapı Sarayı Müzesi Sultanahmet, Fatih"
Bursa Iskender Kebapcisi,6124295,Gazi Mustafa Kemal Cad. No:10/A
Seyidoglu,5028990,Bahcelievler Mah. Izzettin Calislar Cad. No:32/A
Adana Yüzevler Kebap,3551880,"İstasyon Cad. No:21/A Göztepe, Kadıköy"
Kirazli Bahce,90216 5336603,"Site Mah. Cevahir Cad. Umraniye 34760 Istanbul Umraniye, Armagan Evler"
Namli Rumeli Meatball Restaurant,5112196,Hoca Pasa Mah. Hoca Pasa Sok. No:9
City's Namlı Gurme,02123732870,Tesvikiye Caddesi No:12
Birtat Döner,02126179992,Cevat Paşa Mah. Millet Cad. No:241
Sark Pide Firini,6386279,Kadirga Limani Cad. No:8
Cinar Yemek,"
",34437 Cumhuriyet CD
Hasan Cafe Bar,90-2122514218,"Banker Sokak, 7"
Meshur Konyalim Etli Ekmek,4474702,Postahane Mah. Taaffuzhane Cad. No:54
Bahçeli Et Lokantası,6524169,Doğu Sanayi Sitesi 12. Blok D:30 Bahçelievler
Sultanahmet Halk Koftecisi,3465550,Bahariye Cad. Suleyman Pasa Sok. No:16
Döner Y,2365290,Muallim Naci Cad. No:1 D:1
Havuzbasi,0 212 517 3913,"Kennedy Cd, Muhsine Hatun Mh., 34200 Fatih/Istanbul, Turkei"
Foodist Cafe,0212 249 90 80,Cihangir Mah. Sıraselviler Cad.Bakraç Sokak No: 26
Bambi Cafe,2252715,"Cumhuriyet Cad. No:57 Şişli Merkez, Şişli"
Burger King,4529500,Yalniz Selvi Cad. M1 Merkez No:197 K:Zemin D:15
Marca Restaurant & Bar,+902122405700,Abdi Ipekci Cad. Zati Apt. No:40 K:1 D:2
Burger King,6406200,Altıntepsi Mah. Ferhat Paşa Çiftliği Mevki Ora No:14 K:2
Kofteci Hamdi Baba,3314406,Hisar Yolu No:9/A
Asma Alti Restoran,0212 228 10 70,Garipce Koyu
Kahve Mania,902163491509,Bagdat caddesi 144 Feneryolu
Marmara Donercisi,0212 5204585,"Mercan Mahallesi, Fidancilar Caddesi, No 13, Fatih"
Meshur Rumeli Koftecisi,2602036,Yildiz Mah. Yildiz Cad. No:57/B
Çıtır Usta,6629595,Şenlik Mah. Yeşilköy Asfaltı Harman Sok. Flyinn Alışveriş ve Yaşam Merkezi No:48 K:1 Bakırköy
Kent Bufe,3369856,Sogutlucesme Cad. Kadikoy Palas Pasaji No:7 D:10
Little Caesars,3461306,Ataturk Oto Sanayi Sitesi Nazmi Akbaci Is Merkezi D:135
Elif Bufe Gida,5260940,Ordu Cad. No:290/B
Cem Ocakbaşı,02125913196,Avcılar Merkez Mah. Reşit Paşa Cad. No:34/C
FISHPARK BalIk Restaurant,2122774994,emirgan cad. capari sk. no:50/A
Tatlıses Kebap,4336323,İnönü Mah. Bağcılar Cad. Öztatlı Center No:1 Bağcılar
Şerif Restaurant,(0212) 291 99 55 - 56,Cumhuriyet Cad.No: 36/1
Borsa Restaurant,3455333,"Pınar Mah. İstinye Bayırı Cad. İstinyePark Alışveriş Merkezi K:1 D:461 İstinye, Sarıyer"
Domino's Pizza,2026006,Uskumru Cad. No:6
cadde karadeniz ev yemekleri,902163308053,67 Sogutlu Cesme Caddesi
WienerWald Zekeriyaköy,3421111,Maden Mah. Kilyos Cad. Zengin Apt. No:199
Sushico Wyndham Kalamis,(0216) 330 07 94-95 ,Munir Nurettin Selcuk Cad. No:40/1 Kalamis Kadikoy
Bereket Döner,4410336,Bahçelievler Mah. Adnan Kahveci Bulv. No:58
Flavio,+ 90 (212) 243 28 43,"Gönül Sokak No: 1A-3A, Tunel, Beyoglu"
Merakli Kofteci,3951274,Cami Mah. Cumhuriyet Cad. No:71
Derya Balik,3214676,Burhaniye Mah. Camlica Cad. No:6
Balkan Lokantası,5859828,Cihannüma Mah. Akmaz Çeşme Sok. No:8 Beşiktaş
Bambi Cafe,2885959,Yıldız Posta Cad. No:46 Beşiktaş
50 Bistro,212 2430950,Kameriye Sok No:9/A
Sosa,3176165,Halk Cad. Trio Konutlari Hillside City Club K:2 D:99
Domani,2025224,Kilyos Yolu No:46
Köfte Ekmek,02163863051,Sakaci Caddesi
Alo Durumcu Hasan Usta,4699244,Findikli Mah. Palmiye Cad. No:39
Afiyet Kebap,4513112,Mahmutbey Yolu Cad. 8. Sok. No:42
Meşhur Adiyaman Cig Koftecisi Omer Usta,5890888,"Zümrütevler Mah. Çiğdem Sok. No:9/B Zümrütevler, Maltepe"
Ekspres İnegöl Köftecisi,3058830,Morlale Sok. No:23
Meşhur Ayvalık Tostçusu,2512333,"İstiklal Cad. Galatasaray, Beyoğlu"
Kokoreççi Şükrü Usta,0212 883 4681,Atatürk Mah. Gazi Mastafa Kemal Cad. No:85
Taboo,2838900,"Ulus Mah. Adnan Saygun Cad. Salih Rüştü Sok. No:2 Levazım, Beşiktaş"
Huzur Restaurant,2937129,Sait Paşa Geçidi Çiçek Pasajı No:18 Beyoğlu
Sera Restaurant,4554455,Cankurtaran Mah. Ahirkapi Sok. Hotel Armada Istanbul No:24 K:Terasi
Intiba,4413990,Bagdat Cad. Ismet Bey Is Hani D:128
Domino's Pizza,4706500,Libadiye Cad. Somuncu Baba Sok. No:10
KFC,"
",Bagdat Cad. No:341/A
Demircan Restaurant,3194112,Ali Bahadir Cad.
Ala Restaurant,6050363,2. Kisim Yesiltepe Cad. Bogaz Koy Yolu No:82/A
Pilavcioglu,4142734,Bahariye Cad. Sakizgulu Sok. No:17
Edirne Kirkpinar Koftecisi,2789558,Gonca Sok. Emlak Kredi Carsisi D:27-29
Etiler Marmaris Bufe,2995624,Haydar Aliyev Cad. No:196/A
Özsüt,6631490,"Barbaros Mah. Halk Cad. Palladium Alışveriş Merkezi No:8 K:3 D:301 Yeni Sahra, Ataşehir"
Sbarro,6946866,Merkez Mah. Marmara Cad. No:17
Edirne Kırkpınar Lokantası,6641864,İstiklal Sok. Optimum Outlet No:10-4 K:3 D:141 Ataşehir
Burger King,4378010,Otakcilar Cad. Flatofis No:78 K:Zemin D:Z-003
Arasbey Iskender,3056191,Bagdat Cad. No:433/A
Sbarro,8712827,Buyuksehir Mah. E-5 Karayolu Beliyduzu Cad. Marka City No:5 K:2
Aman greek,902122493036,2-14 Tel Sokak
Degirmen cafe pastanesi,02125936440,bostancı köprüsü
Little Caesars Pizza,"
","Petroliş Mah. Üsküdar Cad. No:84 D:2 Rahmanlar, Kartal"
Ezber Bozan Bistro,2664141,Balmumcu Mah. Barbaros Bulv. No:151/B
Seorabeol Korean Restaurant,0212 2752595,"Esentepe Mahallesi, Kore Şehitleri Caddesi, No 57/B"
Sbarro,3342591,"Hakimiyet-i Milliye Cad. No:78 Üsküdar Merkez, Üsküdar"
Adana Dürümcüsü,2491014,Hüseyin Ağa Mah. Halas Sok. No:34 Beyoğlu
Burger King,4911530,Doğu Mah. Ankara Cad. No:128
Burger King,6884613,Uphill Court Ticaret Merkezi K:2 D:B-7
Marmaris Bufe,4738486,Atalar Mah. Uskudar Cad. No:75 D:1/D
Dostlar Restaurant,2167622018,Liman Yolu No:4
Murat Kelle Paça İşkembe ve Kebap Salonu,2926480,Katip Mustafa Çelebi Mah. Büyükparmakkapı Sok. No:5 D:1 Beyoğlu Merkez
Akasya Kebap,5495107,OSB Esot Sanayi Sitesi O Blok D:16
Pizza Hut,"
",Barbaros Bulv. No:7/B
Burger King,6605014,Zeytinlik Mah. Fahri Koruturk Cad. No:45
Burger King,5115659,Ankara Cad. No:221
Catwalk,"
",Atakoy Marina park
Köfteci Ramiz,4480348,İçerenköy Mah. E-5 Karayolu CarrefourSA K:2 D:6 Ataşehir
Taksim Tekirdağ Köftecisi,2448363,Cumhuriyet Cad. No:18/A Beyoğlu
Nokta Tesisleri,0 212 683 81 45,Eski Edirne Asfalti Arnavutkoy Orman Girisi No:92 Arnavutkoy / Istanbul
Changcheng Restaurant,02125172130,Cankurtan mah. akbıyık cad. kutlugün sok no : 23
Orient Cafe,5123075,Molla Fenari Mah. Nuru Osmaniye Cad. No:75
Borsa Restaurant,212-511-8079,Yali Kosku Cad. Yali Kosku Han D:20/D
Hak Evrensel Hatay Sofrası,+(90)2126630700,Yeşilköy Halkalı Cd. No: 95 Florya
Marla Cafe & Bistro,+(90)2163493015,Caferaga Mah. ArayIcIbasI Sok. 9/A
Saray Muhallebicisi,5835087,"İstasyon Cad. No:61 İncirli, Bakırköy"
Burger King,4372070,Kocatepe Mah. Sehir Parki Cad. Forum Istanbul K:3
Numnum,3530708,Buyukdere Cad. Kanyon Alisveris Merkezi No:185 K:K1 D:175
McDonald's,3540120,Istanbul Cad. Mesa Studio Plaza No:29
Burger King,3272576,Ortakoy Mah. Saglik Sok. No:18
McDonald's,6600053,Halit Ziya Usakligil Cad. Carousel Alisveris ve Yasam Merkezi No:1 K:2 D:8
Ikbal,3688244,Bagdat Cad. No:382
Limon Pastanesi,"
",Buyuk Resit Pasa Cad.No:18
Atom Tost,6512866,Mahir Iz Cad. Capitol Alisveris ve Eglence Merkezi K:Zemin
Atom Tost,5458585,Cumhuriyet Meydani Gaziosmanpasa Alisveris ve Kultur Merkezi K:4 D:20
Corner Cafe Bistro,3430608,Halaskargazi Cad. Sites Sinemasi Pasaji
Suhan Kebap,3597800,Kozyatagi Mah. Inonu Cad. No:72
Cakir Kofte,4350563,Esenler Cad. No:14
La Masa,4562980,66. Ada Mozaik Carsi No:16
Bolulu Hasan Usta Süt Tatlıları,2592424,Muallim Naci Cad. No:19 Beşiktaş
Nur Manti,3843548,Kozyatagi Mah. Bayar Cad. Sari Kanarya Sok. No:13/A
Citir Kokorec,2412956,Dolapdere Cad. No:227
