isim,tel,adres
Konyalim Restaurant,3674226,Altintepe Mah. Bagdat Cad. No:60
Bektasoglu Pide,3526728,Maresal Fevzi Cakmak Cad. No:41/B
Gold Stone,3383288,Caferaga Mah. Tavuz Sok. No:14
Emek Restaurant,2376378,Okcu Musa Cad. Yeni Merdiven Sok. No:9
Yakamozlar Balik Fast Food,4992305,Kemerdere Mevki No:916
Gaziantepli Kebap,4706547,Barbaros Mah. Ortabahar Cad. No:19
Bahçekapı Lokantası,5224147,Hobyar Mah. Hacı Küçük Cami Sok. Hacı Polu Han No:44 Sirkeci
Hasir Cag Kebap Salonu,3908508,Kaynarca Mah. Deniz Cad. No:36
Tunc Kebap,4257115,Ruzgarlibahce Mah. Orhan Veli Kanik Cad. Yakut Sok. No:6/A
Kup Lahmacun & Kebap Salonlari,3074009,Ankara Cad. No:145
damak tadI,3425100,dr fahri atabey
Domino's Pizza,3423279,Kilyos Cad. No:111
Oses Çiğköftecisi,6303332,"Merkez Mah. Eski Edirne Yolu Cad. No:27 Kocasinan, Bahçelievler"
Bafradan,2627306,Baglar Yolu Cad. No:3
Kasik-La,3800333,Buyukdere Cad. Istanbul Cevahir Alisveris ve Eglence Merkezi No:22 K:5 D:517
Uc Nokta,2443244,Istiklal Cad. Ayhan Isik Sok. Deniz Apt. No:11
Wide Screen,4555286,Girne Cad. No:16 D:2
Paparazzi Bufe,3452468,Kurbagalidere Cad. No:48
Oz Koru Restaurant,4514704,Carsi Mah. Ayazma Reyhan Sok. No:14
Longtable,2248181,Tesvikiye Cad. The Sofa Hotel No:123
Donerci Ali Efendi,5809292,36. Ada Sedef Cad. Ata Bloklari D:38
Baran Bufe,3496454,Sehit Kahya Sok. Basak Apt. No:15
Oda Bufe,5124768,Yali Kosku Cad. No:8
Jave Cafe,+90 212 518 76 63,Peykhane Caddesi Su Terazisi Sok 9A
Saley Kebap,4699569,Cami Sok. No:26
Açık Büfe,5455070,Acıbadem Mah. Acıbadem Cad. No:67 D:1 Üsküdar
Cesme Basi Kebap,4694999,Eski Uskudar Yolu G38 Sok. No:25
Melek Restaurant,4345938,Cumhuriyet Koyu Riva Sapagi
Selanik Kurufasulyecisi,5755666,Eski Uskudar Cad. Mezarlik Sok. No:4
Sogut Bufe,5757393,Findikli Mah. Ataman Cad. No:28 D:8
Cafepark,3807313,İnönü Cad. Türaboğlu Sok. No:91/C
Bahceden Ev Yemekleri,4559713,Kamelya Carsisi T16 Blok K:3 D:17
Cadde 34,4810486,Atatürk Mah. Alemdağ Cad. No:144
Coco Clementine,3522630,Yildirim Goker Cad. Mayadrom Akatlar Alisveris Merkezi K:Giris
Nunyo Lokanda Bar,3528547,Tepecik Yolu Alkent Sitesi F Blok No:13 D:32
Zeytin Agaci Cafe,2912842,Vali Konagi Cad. Polat Is Hani No:56 D:29
A la Turka Safir,2587924,Muallim Naci Cad. Degirmen Sok. No:16
Dome Pico,4630222,Bagdat Cad. Kosk Apt. No:10 D:428
Bahane Kultur,4490854,Kadife Sok. Aysel Kurtay Apt. No:27 D:2
Palaimon Fish Restaurant,3857721,Dr. Faruk Ayanoglu Cad. No:1/C
Session Cafe,2847801,4. Levent Kule Carsi Is Kuleleri No:16
Cafe Gramofon,2631505,Cevdet Paşa Cad. Bağ Arası Sok. No:2/A Bebek
Kebap Sokagi,6290703,Mozaik Carsi K:1 D:15
Krunch,6693008,Golet Mevki Doga Parki Cad. Prestige Mall Alisveris Merkezi K:Zemin
Paragon Cafe,+(90)2122832545,"Emniyetevleri Mahallesi, Ozcan Sokak"
Ekin Cigkofte,+90/212/5284503,Saka Mehmet Sk. 21 Eminönü
Kaburga Sofrasi,5327373,Kenedi Cad. No:89
City Brasserie,3440200,Buyukdere Cad. Metrocity Alisveris Merkezi No:171 K:3 D:303
Sunroof,3281990,Dereboyu Sok. Sun Plaza No:24 K:31
Bosphorus Fresh Fish,2710073,Rumelikavagi Mah. Iskele Cad. No:1
Raquette Restaurant,2765087,Poligon Mah. Poligon Cad. Enka Okullari Sadi Celik Spor Tesisleri
Balikhane Restaurant,5807222,Basinkoy Mah. Istanbul Cad. No:39
Kaptan Restaurant,5731557,Yesilkoy Mah. Camozu Sok. No:10
Lounge & Kitchen,5734890,Ulus Mah. Adnan Saygun Cad. Leylak Apt. No:1 D:18
Kekik Fast Food,6618633,Bakirkoy Sahil Yolu Galleria Alisveris Merkezi K:Zemin
HD Iskender,4480234,Eski Genoto Arsasi E5 Karayolu CarrefourSA K:2
Pinar Restaurant,4576000,Turgut Ozal Cad. Yeni Sahil Yolu No:41
Annem Manti,2769870,Merkez
Saheste Kahvalti ve Ev Yemekleri,3422448,Kartal Baba Cad. No:116/A
Hilal Kofte Restaurant,5288992,Asmaalti Cad. Kalcin Sok. No:21/D
Kaloni Restaurant,4734674,19 Mayis Mah. Ataturk Cad. Esin Sok. No:9/B
Sera Restaurant,2211566,Halil Rifat Pasa Mah. Perpa Ticaret Merkezi B Blok K:5 D:495
Nigmet Kebap ve Durum Salonu,5114947,Hocagiyasettin Mah. Haci Kadin Cad. No:124
Uygar Su Urunleri,5162765,Balik Hali No:32
Atakoy Balikcisi,5422355,Daim Halk Pazari No:13
Yildiz Balik Evi,3891884,23 Nisan Cad. Hamam Sok. No:3 D:1
Tunhas Su Urunleri,4580317,Katip Kamil Mah. Balik Hali Keneddy Cad. No:126
Balikcimiz Hasan,3544236,Dogu Mah. Ankara Cad. No:147
Van Breakfast,5220859,Ataturk Bulv. No:168 D:2
Leziz Iskender Kebap,3169921,Alemdag Cad. Ciftlik Sok. No:6/B
Little Caesars,8726000,Beylikduzu Mah. Cumhuriyet Cad. Imamoglu 1 Sitesi D:30-31
Koftem Kofte Restaurant,5086877,Yavuz Selim Mah. Istanbul Cad. No:129
Durak Pide,6179615,Barbaros Hayrettin Pasa Mah. Mimar Sinan Cad. 1112. Sok. No:4
Efe Ocakbasi,2263653,Maresal Fevzi Cakmak Cad. No:4
Kuruderi,6801627,Vatan Cad. No:2/B
Kuruderi Pide ve Lahmacun Salonu,4130008,Soguksu Mah. Mehmet Akif Ersoy Cad. No:54/C
Tadim Cizbiz Kofte,4502216,Rasim Pasa Mah. Yavuz Turk Sok. No:50
Kristal Bufe,3024128,Bagdat Cad. No:374 D:10
Piknik Bufe,4284133,Acibadem Cad. No:79/B
Gokhan Bufe,6401996,Kartaltepe Mah. Merkez Hal A3 Blok
Deniz Bufe,4184317,Sogutlucesme Yaya Alt Gecidi D:10-11
Sarioglu Bistro,5268653,Asirefendi Cad. No:2 D:2
Fırat Pide,5176732,Atalar Mah. Atalar Cad. Yayla Sok. No:23 Kartal
Cafe Irem,5015349,Maltepe Cad. No:5
Basak Bistro,5745587,Fevzi Pasa Cad. No:42
Onder Bufe,2836455,Levent Mah. Akcam Sok.
Yildiz Bufe,2744748,Yildiz Posta Cad. Ayyildiz Sitesi No:29
Ak Bufe,5759398,Uluscu Cad. No:114
Kulunkoglu Pide Kebap Lahmacun Doner Salonu,3211356,Girne Cad. No:7/C
Ekin Bistro,5476224,Yenidogan Mah. 48. Sok. No:112 D:2
Vip Bufe,5643021,Fevzi Cakmak Mah. Ali Galip Bey Cad. No:4
Tim1 Bufe,5443973,Davut Pasa Cad. Tim 1 Is Merkezi No:10
Umut Bufe,6649888,101. Sok. No:99
Kardesler Bufe,5772173,Litros Yolu Kose Han No:9
Bir Bufe,4164440,Bagdat Cad. Selvili Sok. Sedir Apt. No:1 D:3
Varlik Bistro,6656607,Telsiz Mah. 85. Sok. No:90
Kaya Bufe,3456620,Muhurdar Cad. Akmar Pasaji No:70 D:16
Tek Bufe 4,5539273,Cavuslar Cad. No:88
Seyidoglu Bufe,6406991,Sebze Meyve Hali No:111
Pasa Palace,5108272,Bestelsiz Mah. 107 Sok. No:60
Arzu Kebap Salonu,6802683,Bogazici Cad.
Dinc Ev Yemekleri,3237908,Orta Cesme Cayir Cad. No:202/A
Berker Bufe,5788164,Baglarbasi Mah. Kucukkoy Yolu No:56
Ciz Biz Kofte,8739794,Istanbul Cad. Turgut Ozal Bulv. Fox City Outlet No:2 K:4
Bereketli Bufe,4460260,Evliyacelebi Mah. Istasyon Cad. Giptas Sanayi Sitesi A Blok D:47
Dilber Bufe,4853770,Acarkent Mah. 3. Kisim 9. Cad. No:3/B
Merkez Kokorec,3958479,Cami Mah. Istasyon Cad. No:54
Tazmanya Bistro,2802915,Ibrahim Karaoglanoglu Cad. No:93/A
Yildiz Bufe,4736259,Tahsin Kaya Sanayi Sitesi Inonu Cad. Erdal Sok. B Blok D:8
Genc Bistro,6580698,Altintepsi Mah. Buyuk Istanbul Otogari Istasyon Binasi No:16
Orcu Bufe,6559353,Kirazli Cad. No:44/B
Ozturk Bufe,6108311,Menderes Mah. Cincin Dere Cad. No:145/A
Potamya Bufe,5610545,General Sukru Kanatli Cad. Belediye Hekim Sok. No:10/A
Sik Bistro,5135435,Mollafenari Mah. Mahkeme Sok. No:2 D:6
Ozun Pide ve Borek Salonu,5212059,Cakmak Mah. 23 Nisan Cad. No:5
Edemoglu,4236704,Mustafa Kemal Pasa Mah. Istiklal Cad. Karadut Sok. No:80 D:4
Istanbul Pilavcisi,4357981,Soganli Cad. No:119/C
Anadolu Pastry & Turkish Pizza Restaurant,2538547,Mahmut Sevket Pasa Mah. No:4
Sanlioglu Lahmacun,2835557,Sanayi Mah. Sultan Selim Cad. No:77
Gokhan Bufe,6131166,Pasmakci Sanayi Sitesi Rami Kisla Cad. D:33
Bahcesehir Bufe,6693666,Hadimkoy-Bahcesehir Yolu No:14
Gaziantep Sofrasi,3542915,Bati Mah. Dr. Orhan Maltepe Cad. No:9
Cinar Bufe,3717202,Saraylar Cad. Eski Pazar Sok. No:1
Alapli Bufe,6329691,Haseki Cad. No:31/E
Bronz Bufe,4503000,Recep Peker Cad. Zuhtu Pasa Mektep Sok. No:1/C
Enerji Bufe,6144674,Baglarbasi Mah. Kucukkoy Yolu No:130
Beyaz Durum,3309536,Moda Cad. No:108/B
Ozturk Bufe,2766679,Vakif Bahce Trafo Cikmazi No:19
McDonald's,6314725,Adnan Menderes Bulv. Historia Alisveris Merkezi No:2 K:3 D:49
Morgul Bufe,2672528,Lati Lokum Sok. No:7/B
Gulistan Restaurant,2621058,Kirecburnu Mah. Kefeli Koy Cad. No:29
Wineport,2582626,Cigdem Sok. No:3
Little Caesars,2322366,Nuzhetiye Cad. No:35
Koyum Kebap Salonu,7896655,Ferhat Pasa Mah. Mescit Sok. No:24/A
Pizza Bulls,5662188,Fahrettin Kerim Gokay Cad. No:186
Kuppeli Bistro,2412898,Halaskar Gazi Cad. No:302
Royal City,0212 643 00 25,Keresteciler Sitesi Fatih Cad. Limon Sok. No:4
Gelincik Cafe,2666333,19 Mayis Mah. Dr. Ismet Ozturk Cad. No:26/A
Promethe Cafe,4182247,Muvakkithane Cad. No:39 D:1
Kumsal Balık Lokantası,3867375,İskele Sok. No:36 D:5 Kadıköy
Emmim,6621250,Florya Turistik Tesisleri Eski Moteller Son Blok
Balci Kofte,5542224,Sehit Yarbay Cesur Cad. No:31
Yildirim Sofrasi,6378176,Ferah Sok. No:18
Nur Bufe,5923248,Kartaltepe Mah. Suvari Cad. No:17
Bacaksiz Cafe,6659593,Demirciler Sitesi 8. Yol Galaksi A Blok D:75-77
Nes'e Izgara,3362131,Gazi Muhtar Pasa Sok. No:54 D:3
Bereket Pide,5528841,Hurriyet Mah. Hurriyet Cad. No:133
Yavuz Kardesler Pide Salonu,5499969,OSB Dolapdere Sanayi Sitesi 20. Ada D:33
Hacioglu Tantuni & Kebap Salonu,6541985,Ahmet Yesevi Cad. No:30
Osmanli Kebap,6594418,ISTOC Sanayi Sitesi 23. Ada D:39
Bahcelievler Restaurant,4416092,Talat Pasa Cad. No:33/A
Sulh Kebap Salonu,4529025,Mithat Pasa Cad. No:29
Yudum Kofte,4942495,Mehmet Akif Mah. Ikitelli Cad. No:91
Haci Veliogullari Kebap,4943780,Mehmet Akif Mah. Ikitelli Cad.
Sakinler Iskender,3475656,Yildiz Posta Cad. Villa Sok. No:77
Kaptan Balik Evi,5717358,Incirli Cad. Deniz Apt. No:74
Yıldırım Büfe,5757507,"İçerenköy Mah. Sanayi Yasemin Sok. No:19/A İçerenköy, Ataşehir"
Yorem Kebap,4950310,Eski Baglar Mah. Zeynebiye Cad. No:53
Kibar Yemek Salonu,4665100,Incirli Cad. No:56
Merkez Bufe Doner,6399196,Yildirim Beyazit Cad. No:233
Bereket Kebap,6302535,Kirazli Cad. No:3/C
Imren Durum,4516265,Yildirim Beyazit Cad. No:227
Valentino Kartallar Restaurant,5172254,Muhsine Hatun Mah. Capari Sok. No:32
Akat Park Cafe Restaurant,3516374,Zeytinoglu Cad. Yaren Sok. No:14
Ziyade Restaurant,5712020,Incirli Cad. No:89
Bizim Gazino Restaurant,2623137,Kirecburnu Mah. Haydar Aliyev Cad. No:44
Burger King,3800747,Buyukdere Cad. Istanbul Cevahir Alisveris ve Eglence Merkezi No:22 K:5 D:523
Burger King,2256950,Rumeli Cad. No:2 D:2
Burger King,4480207,Eski Genoto Arsasi E-5 Karayolu CarrefourSA K:2
Burger King,3398833,Acibadem Mah. Fatih Cad. Tepe Nautilus Alisveris Merkezi No:1 K:2 D:99
Cafe Yafe,2809092,Buyukdere Cad. Eczaci Ali Kaya Sok. Pol Center No:6
Bistro Mira,4656601,Ataturk Cad. Goztepe Yolu No:8
Last Stop,3027834,Bagdat Cad. No:291
China Club,2930602,Akyol Cad. No:29/A
China Plaza Restaurant,2924570,Siraselviler Cad. No:25
Cagri Bufe,2417583,Vali Konagi Cad. No:109
Dibek Restaurant,5550912,Haznedar Mah. Marmara Cad. No:7
Marmaris Bufe,4664488,Incirli Cad. No:38/b
Sor Cigkofte cihan usta,02124267490,GÜLTEPE MAH BAĞLAR CAD NO:97 SEFAKÖY
Gul Antep Kebap Salonu,4713100,Mehmet Akif Mah. Asik Veysel Cad. No:36
Gol Ocakbasi,4952798,Ataturk Mah. Ikitelli Cad. No:4
Sude Cafe,2719398,Sehit Mithat Yilmaz Cad. No:31
Gastus,2278019,Sinanpasa Mah. Dolmabahce Cad. No:25
Pizza & Pizza,8637383,Mustafa Kemal Pasa Bulv. No:34/A-B
Koftecim,2828552,Ortabayir Mah. Talat Pasa Cad. No:32
Bakirkoy Koftecisi,5701020,Husreviye Sok. No:8
Mola Lezzet Sofrasi,5323236,Kircesme Mah. Itfaiye Cad. Kadinlar Pazari No:20/A
Bilge Kebap Lahmacun,6933066,Ataturk Mah. Ikitelli Cad. No:209
Park 156,3065894,Ankara Cad. No:156
Emin Baba Durum Evi,2123000,Gulbahar Mah. Karanfil Sok. No:1/B D:46
KFC,"
",Nispetiye Cad. Akmerkez Alisveris Merkezi K:3 D:423-424
Duran Sandwiches,3248286,Konaklar Mah. Selvili Sok. No:13/B D:10
Kardesler Restaurant,3601385,Mimar Sinan Mah. Istanbul Cad. No:84/A
Domino's Pizza,3278080,Acibadem Cad. Safak Apt. No:179 D:2
Kismet Lavas ve Durum Salonu,5512837,Fevzi Cakmak Mah. Fatih Cad. Yakut Sok. No:17
Bizim Doner,4233228,Sifa Mah. Emiroglu Cad. No:151
Ayguller Restaurant,4879658,4. Etap 1. Kisim Mevlana Celaleddin Rumi Cad. No:25
Inegol Koftecisi,5284854,Mercan Mah. Tacirhane Sok. No:2
Damak Cafe,5702270,Turkcu Sok. Kayali Apt. A Blok K:3 D:9
Extreme Kofte,2313106,Halaskar Gazi Cad. No:107
Kebapci Cobanbey,6527738,Fatih Cad. No:31
Er Bufe,4891068,20. Sok. No:4
Turuncu Bufe,3277977,Barbaros Bulv. No:29/A
Sengul Kebap,6793751,Telsiz Mah. 69/1 Sok. No:22
Maltiz Kofte,8682618,Guzelce Koyu E-5 Karayolu
Meshur Donerci Ali Dayi,8839141,Dizdariye Mah. Belediye Cad. No:10/A
Durak Turkish Pizza Restaurant,3749274,Topselvi Mah. Sen Sok. No:3 D:1
Koc Kebap,3071046,Gullubaglar Mah. Ankara Cad. No:242
Sofra Restaurant Bar,4166323,Bagdat Cad. No:546
Sukru Usta Kebap Salonu,3374717,Sogutlucesme Cad. Yavuzturk Sok. No:42
Kosova Meat Restaurant,5737838,Istanbul Cad. No:10
Adli Restaurant,3951631,Cami Mah. Sehitler Cad. No:33
Marso Gida Hot Chicken,2321081,Halaskar Gazi Cad. No:57
Yildiz Restaurant,2885889,Cemal Sahir Sok. Yonca Apt. No:5 D:3
Inegol Restaurant,2722819,Ozturk Sok. No:3/A
Food Time,5706130,Fahri Koruturk Cad. Yakut Sok. No:10
Sakli Bahce Restaurant,2420793,Kilyos Yolu Cad. No:99
Rifat Usta Restaurant,5718663,Sakiz Agaci Mah. Kennedy Cad. No:67
Kristal Bufe,6583756,Otogar A1 Kulesi
Hocaogullari Gida,5012497,Numunebag Cad. No:14
Sepetcioglu Pide Salonu,5063380,Inonu Cad. No:26
Tosunlar Kebap,5507870,Koca Sinan Merkez Mah. Mahmutbey Cad. No:379/C
Ozyildirimlar,5159752,Gulbahar Cad. Gumus Sok. No:45
Kebapci Dede,5578139,Ahmet Kutsi Tecer Cad. Kinali Tepe Sok. No:24
Silmar Silivri Marina Restaurant,7280632,Piri Mehmet Pasa Mah. Huseyin Tufan Sok. Eski Mezba Binasi No:2
Zarnet,2693436,4. Levent Oto Sanayi Sitesi Ataturk Cad. No:29
Meshur Koca Guvec Pide Salonu,5810332,Halit Pasa Cad. Gazi Center Is Merkezi No:21
Lacin Cafe & Restaurant,5740421,Halkali Cad. No:59
Kristal Bufe,2338559,Bozkurt Mah. Ergenekon Cad. No:21
Koci Restaurant,2215519,Perpa Ticaret Merkezi 13A Blok D:1961
Fuar Pide Doner,8836809,Dizdariye Mah. Ataturk Cad. No:23/C
Yesil Bursa Iskender Restaurant,2706047,Talat Pasa Cad. No:64
Yildiz Restaurant,3897355,Kordonboyu Mah. Ankara Cad. No:80
Cali Restaurant & Bar,4293887,Cumhuriyet Mah. Yeni Sile Otobani No:4/A
Urfali Istanbul Kebap,5834589,Yeni Mah. Istanbul Cad. No:77/A
Tanriverdi Kebap,5821566,Yenidogan Mah. 58. Bulvar Cad. No:103
Bahar Kebap,3500415,Halk Sok. No:18
Erin Gida,6543017,Zafer Mah. Bahargulu Sok. No:11
Marmara Ziyafet,2566956,Piyalepasa Mah. Kuzey Sok. No:95/A
Rhiss Restaurant Maltepe,+(90)2163523333,Zumrutevler Mah. Ataturk Cd. Maltepe
Nergiz Bistro,2320466,Cumhuriyet Cad. Babil Sok. No:2
Ayder Sofrası,02125676880,Yenidoğan Mah. Abdi İpekçi Cad. Burcu Sok. No:2/A
KFC,"
",Tugay Yolu CarrefourSA No:73 D:142
KFC,"
",CarrefourSA Alisveris Merkezi K:2 D:R24
KFC,"
",Acibadem Mah. Fatih Cad. Tepe Nautilus Alisveris Merkezi No:1 K:2 D:105
KFC,"
",Senlik Mah. Yesilkoy Asfalti Harman Sok. Flyinn Alisveris ve Yasam Merkezi No:48 K:2 D:72
Nihat Usta,3390061,"Acıbadem Cad. Rauf Paşa Hanı Sok. Çamlıca Konakları No:29 Acıbadem, Üsküdar"
By Corbaci Soup Bar,2445169,Tomtom Mah. Yeni Carsi Cad. No:8/A
Potato Republic,8730969,Buyuksehir Mah. E-5 Karayolu Beylikduzu Cad. Beylicium Alisveris ve Yasam Merkezi No:9 K:4
Aydınlar İskender,02125400071,Halkalı Cad. No:185/A
El Pavo,8712697,Buyuksehir Mah. E-5 Karayolu Beylikduzu Cad. Beylicium Alisveris ve Yasam Merkezi No:9 K:4
Pakette Cihangir,+(90)2122430309,Pürtelaş Hasan Efendi Mah. Akyol Cd. 1/A Cihangir/Beyoğlu
Pilavcı Resul Usta,5801778,"Ahmet Kocabıyık Cad. Kalender Apt. No:9 Sefaköy, Küçükçekmece"
Pilavcı Resul Usta,5924603,"Cennet Mah. Hürriyet Cad. No:52 Küçükçekmece Merkez, Küçükçekmece"
Jazzve Cafe,+(90)2122529002,Necatibey cd. Vekilharç sk. no:6 Karaköy
Mantı Keyfi,3424223,"Zekeriyaköy Cad. Kuğu Sok. No:6 Zekeriyaköy Köyü, Sarıyer"
Mantı Keyfi,6405650,"Mimar Sinan Mah. Mimar Sinan Cad. No:63/D Çekmeköy, Çekmeköy"
Ayhan Usta Kardeşler Kebap Pide Lahmacun Salanu,5553726,Ulubatlı Hasan Cad. Çınar Sok. No:18
Ayışığı Özbek Mutfağı,5714647,Zeytinlik Mah. Yakut Sok. No:29/B
Tatlıses Çiğ Köfte,3301525,"Recep Peker Cad. No:30/1A Kızıltoprak, Kadıköy"
Manolya Pide Salonu,6611583,Mithat Pasa Cad. No:2
Tatlıses Çiğ Köfte,2302830,"Abide-i Hürriyet Cad. No:201 Şişli Merkez, Şişli"
Teras Restoran,3489528,"Rıhtım Cad. Nemlizade Sok. Sidonya Hotel No:34 Kadıköy Merkez, Kadıköy"
Life Restaurant,6680925,Anadolu Hisari Mah. Goksu Goztepe Yolu MMM
Mustafa'nın Yeri,8836263,"19 Mayıs Mah. Şevki Arı Cad. D:32 Büyükçekmece Merkez, Büyükçekmece"
Dinner Park Brasserie,2436749,Asker Ocagi Cad. Suzer Plaza No:15
McDonald's,6995272,"Saadetdere Mah. 68. Sok. Torium Alışveriş Merkezi No:50 K:3 D:R15 Esenyurt, Esenyurt"
Domino's Pizza,4898484,Bagdat Cad. No:116
Kav-Pi,5378040,Yavuz Sultan Selim Cad. No:15/A
Domino's Pizza,4951819,Halkali Cad. No:21
Garden Doga,5601664,Bakirkoy Sahil Yolu
Bayramoglu Ziyafet Sofrasi,3350033,Alemdag Cad. No:18/A
Tatlises Kebap,2802526,Seyrantepe Mah. Ibrahim Karaoglanoglu Cad. Dilek Sok. No:31
Domino's Pizza,3222535,Belediye Cad. Kemer Life Carsisi No:26 D:255
Ozyurek Kokorec,4126159,Ataturk Mah. Alemdag Cad. Ciftlik Sok. No:2/A
Tatlises Kebap,2955544,Yahya Kemal Mah. Cendere Cad. No:52
Domino's Pizza,3463333,Ataturk Oto Sanayi Sitesi Nazmi Akbaci Is Merkezi D:78
Domino's Pizza,3254565,Konaklar Mah. Akcam Sok. No:32
Veli Baba Izgara Salonu,4611510,Namik Kemal Mah. Cengiz Topel Cad. No:68
Domino's Pizza,2295600,Istinye Cad. No:64
Hacioglu,2275689,Ihlamurdere Cad. Mumcu Bakkal Sok. No:20
Hacioglu,4410714,Sureyya Pasa Sahili Turgut Ozal Bulv. No:183
Hacioglu,6102444,Nene Hatun Mah. Davut Pasa Cad. No:34
Hacioglu,5349029,Fevzi Pasa Cad. No:26
Hacioglu,3877938,Hurriyet Cad. No:1
Hacioglu,4480456,Eski Genoto Arsasi CarrefourSA
Yesilkoy Kofte House,4882832,Ziyagokalp Mah. Basaksehir 5. Etap Ugur Trend Is Merkezi D:24
Yesilkoy Kofte House,6583222,Altintepsi Mah. Istasyon Binasi D:59
Gözde Restaurant,0212 516 87 01 / 0212 518 41 94,Divan Yolu Cd. Peykhane Sk. 7-B
Nokta Kebap,3222839,Cumhuriyet Cad. No:22
Donerciim,3437678,Nuhkuyusu Cad. No:285/A
Cadde,5236310,"Oğuzhan Cad. No:33/D Fındıkzade, Fatih"
Durmaz Ocakba,+902125946083 ,Asfalt
Toros Tantuni,4468252,Gunesli Mah. Tasocagi Yolu No:11/D
Gökyüzünde Yemek,2448264,"Bankalar Cad. Şark Han No:16 K:5 Karaköy, Beyoğlu"
Little Caesars Pizza,4662222,"İkbal Cad. No:15 D:1 Çakmak, Ümraniye"
Smoothy,2152270,Buyukdere Cad. Astoria Alisveris Merkezi No:127 K:2
Bade Restaurant,2496740,Balik Pazari Nevizade Sok. No:17-19
Ism-i Nur Cafe,2310180,"Abdi İpekçi Cad. No:81 D:3 Maçka, Beşiktaş"
Unes Bufe,4525285,Yenibosna Mah. Yildirim Beyazit Cad. No:235
Kardesim Kebap,4744556,Icadiye Mah. Gumus Yolu Cad. No:3
Celine's,+902122961100,"Valikonağı Cad. No:42 Nişantaşı, Şişli"
Burger King,4341822,Sancaktepe Mah. Çarşı Cad. No:10/C
salto,+(90)5323144845,Tesvikiye Mah. Citys Avm
Rumeli Kurufasulyecisi,2881059,"Büyükdere Cad. Eski Osmanlı Sok. No:4/D Mecidiyeköy, Şişli"
Manca Cafe,5654605,"Fahrettin Kerim Gökay Cad. No:138 Göztepe, Kadıköy"
Bağcı Büfe,02128724243,Beykent Sanayi Sitesi B Blok D:324
Bahçe Köfte,02165260041,Çamlık Mah. İkbal Cad. No:168
Bahçe Restoran,3024272,Cemil Topuzlu Cad. Büyük Kulüp No:42
Bahtiyar Kebap Salonu,5806928,Beşyol Mah. Pakten Mutlu Sanayi Sitesi İnönü Cad. No:36 D:76
Baklavacı Bey,02164433002,Libadiye Mah. Gürpınar Cad. No:20/C
Carnaval Bufe,0216 405 25 00,Caferaga Mah. Kadife Sok. Eren Apt. No:6
Cadde-i Kebir Restaurant,2443372,İmam Adnan Sok. No:5/A
Ibrahim nargile cafe,05535961450,Iskele. Cad Mecidiye Mah No 12 Ortakoy Besiktas Istanbul
Komagene,3503636,Atatürk Cad. Rızabey Sok. No:40 D:1 Kadıköy
Lokanta 7/24,2446708,Büyük Parmakkapı Cad. Tel Sok. No:12 Beyoğlu
Bereket Döner,2514221,İstiklal Cad. Sadri Alışık Sok. No:5 Beyoğlu
Diyar Restaurant,2423161,Maden Mah. Bogazici Cad. No:29
Has Baba,5519202,Maresal Fevzi Cakmak Cad. No:24
Balım Cafe Restaurant,02122672811,Gazi Umur Paşa Sok. No:20/A
Banak,02122810870,İş Kuleleri Kule Çarşı Avm D:7
Little Caesars Pizza,3109000,"Nuhkuyusu Cad. Yonca Apt. No:159 D:1 Bağlarbaşı, Üsküdar"
Baran Büfe,02122105095,Perpe Ticaret Merkezi B Blok No:2508 K:3 D:2539
Mori,2122609826,Cevdet Paşa Mahallesi No:56
Sevenler Lokantası,6798399,Yenidoğan Mah. 42. Sok. No:15 Zeytinburnu Merkez
Barış Aile Pide Salonu,02163715860,İnönü Cad. No:18
Barnie's Cafe & Restoran,3024272,Cemil Topuzlu Cad. Büyük Kulüp No:42
Başak Büfe,02124624719,Merkez Mah. İstanbul Cad. No:46
Başköşe Restaurant,4251456,Rüzgarlı Bahçe Mah. Fatih Sultan Mehmet Cad. No:44
Yeni Fenerbahce Iskembe & Kebap Salonu,3368732,Kurbagalidere Cad. Celebi Is Hani No:59 D:2
Aydogdu Bufe,3308437,Kurbagalidere Cad. No:63
La Cucina,3252434,"Samyeli Sok. Hareket Sitesi No:1 Levent, Beşiktaş"
Berat Doyum Bufe,5215626,Marmara Cad. No:30 D:2/B
Sismanoglu Tantuni,3432320,Yeni Toptasi Cad. No:30/B
Bay Aşcı,02125606605,Bakırköy Sahil Yolu Galleria Alışveriş Merkezi K:Zemin
Bayazıt Pide & Börek,02164819012,Atatürk Mah. Yeşil Sok. No:16/B
Sultanahmet Köftecisi,4658707,"Kuleli Mevki E-5 Karayolu Londra Asfaltı Airport Outlet Center K:3 D:89 Ataköy, Bakırköy"
Anteplim Tas Firin Kebap Lahmacun Pide,4722106,35. Cad. No:124/A
Altin Sis Kebap Salonu,5532370,Hakimiyeti Milliye Cad. No:124
Bolulu Hasan Usta Süt Tatlıları,2641664,Nispetiye Cad. Kerem 2 Apt. No:24 D:36 Beşiktaş
Dürümeli Kebap,2434643,Şehitmuhtar Mah. 2/7 Sok. No:3/B Beyoğlu
Meshur Kir Pidesi,3671149,Ataturk Cad. Selamoglu Carsisi No:11
Sark Kebap Salonu,6224165,Sarigazi Mah. Namik Kemal Cad. No:9
Nehir Ev Yemekleri,4173927,Ataturk Cad. Koknar Sok. No:2/A
Yaprak Cafe,2122404457,"Eftal Sok. No:2/G Ondokuz Mayıs, Şişli"
Takko Mec Bufe,4522580,Cumhuriyet Mah. Abdi Ipekci Cad. Ender Sok. No:15
Kocagozler Kebap ve Iskender Salonu,5452353,Hasan Pasa Mah. Sarayardi Cad. No:69
Tatpi Samsun Pidesi,4566500,Ataturk Mah. 38 Ada Arkadli Carsi Ata 3/1 Blok D:31
Cagdas Ev Yemekleri ve Izgara Salonu,3495250,Rustiye Sok. No:3/E
Sultan Ev Yemekleri,3308020,Bagdat Cad. Yolac Is Merkezi No:36 D:21
Ender Lokantası,5787868,Merkez Mah. Ali Galip Bey Cad. No:28 Gaziosmanpaşa Merkez
Koftecim,5040748,Merkez Mah. Fevzi Cakmak Cad. No:3
Gul Sofrasi,5565029,Ataturk Cad. Gul Sok. No:3/A
Seyidahmetoğlu,4358133,"Sancaktepe Mah. Fatih Cad. No:9 Bağcılar Merkez, Bağcılar"
Kebap 89,3533442,Ankara Cad. No:7
Erzurum Sofrasi,4428917,Rihtim Cad. No:53
As Kebap Salonu,3534433,Ankara Cad. No:40
Diyar Bursa Iskender,2176718,Gulbahar Mah. Oya Sok. Tumer Han No:1/D
Koftehor 14,3060033,Ataturk Bulv. Gevrek Sok. No:17/E
Durumcu Bey,6344461,Kucuksu Cad. Bildircin Sok. No:4
Kavacik Kebap,3223319,Cumhuriyet Cad. No:7
Oz Keklik Pilic Cevirme,3228952,Orhan Veli Kanik Cad. No:32
Tandirbasi Restaurant,4921443,Hakimiyet-i Milliye Cad. Kuyumcular Pasaji No:100 D:72
Elezz Doner & Cafe,4133335,Orhan Veli Kanik Cad. No:106
Merkez Kebap Salonu,3240412,Ornek Mah. 35. Cad. No:76
Sera Cafe Restaurant,4461900,Cami Mah. Sahil Dolgu Alani Sehitler Cad.
Tokat Pide Salonu,6220674,"İnönü Mah. Demokrasi Cad. Yeşilova Sok. No:2 Sarıgazi, Sancaktepe"
Sofrayi Cedid,3862937,Ataturk Cad. Orta Sok. No:2
Seçilmiş Döner,8520198,"Beylikdüzü Mah. E-5 Karayolu MMMMM Migros K:1 Kavaklı, Beylikdüzü"
Onder Kebap Salonu,5757388,Kucukbakkalkoy Mah. Cayir Sok. Serdar Apt. No:26
Kardesler Bufe,5731565,Kucukbakkalkoy Mah. Halyolu Cad. No:10/D
Seckin Bufe,5742823,Fevzi Pasa Cad. No:8/A
Kuzen Durum Evi,6225219,Eski Ankara Cad. No:107/B
Kral Cig Kofte,6224887,Ataturk Mah. Demokrasi Cad. No:2 D:5
Antep Sofrasi,5761793,Kayisdagi Yolu Ekintas Apt. No:35 D:1
Gaziantep Sofrasi,6213874,Eski Ankara Cad. No:52
Merkez Birahane Ocakbasi,6214101,Eski Ankara Asfalti No:72
Pizza Pino,4480566,Eski Geneto Arsasi E-5 Karayolu CarrefourSA No:23 K:2 D:7
Bufe Ayvalik,3550919,Istasyon Cad. No:75/A
Cig Kofteci Ramazan Usta,6105225,Cinar Mah. Fatih Cad. No:112/A
Cig Kofteci Ramazan Usta,5322164,Selmani Pak Cad. No:89/D
Cig Kofteci Ramazan Usta,5723839,Sonbahar Sok. No:39 D:3
Elle Kebap,3328627,Bosna Bulv. Nato Yolu No:137
Bereket Pilav,3876498,Kordonboyu Mah. 23 Nisan Cad. Hamam Sok. No:30/B
Meshur Cig Kofteci Ramazan Usta,6576383,Mahmutbey Cad. No:12 D:7
Köfteci Ramiz,3800980,Büyükdere Cad. İstanbul Cevahir Alışveriş ve Eğlence Merkezi No:22 K:5 D:349 Şişli Merkez
Akdeniz Yemekleri,2120880,Cemal Sahir Cad. Profilo Alışveriş Merkezi No:33 K:3 Şişli
Sar Durum,3575151,Tutuncu Mehmet Efendi Cad. No:113
Tilla Profiterol ve Lokma evi,+90 216 386 0050,34738
Kebapçı,3562590,Cemal Sahir Cad. Profilo Alışveriş Merkezi No:33 K:3 D:321 Şişli
Cafe Homini,3476442,Fahrettin Kerim Gokay Cad. No:45/A
Gözde Lahmacun Kebap,6931052,"Fatih Cad. 9. Sok. No:1/A Halkalı, Küçükçekmece"
Cafe Dolunay,4944648,Guzelyali Mah. Istasyon Cad. No:4/B
Kalite Kofte,3585531,Arpaci Cesme Sok. No:2
Adalar Kebap Salonu,2488667,Feriköy Mah. Kurtuluş Cad. No:208 Şişli
Özcan Lokantası,5773411,Orta Mah. Çarşı Cad. No:13 Numunebağ
Cihan Inegol Kofte,4146177,Fahrettin Kerim Gokay Cad. No:27
Yorem Kebap,4136187,Kirecocagi Yolu No:30
Hacioglu,4578787,Cevizli Mah. Denizer Cad. No:63
Hacioglu,4416162,Baglarbasi Mah. Bagdat Cad. No:447
Üçdal Lokantası,5729947,"Ray Sok. No:2/A Zeytinlik, Bakırköy"
Liva Cafe Fast Food,5303702,Kuva-i Milliye Cad. Can Pasajı No:1 Fatih
Tosya Kofte,3425546,Halk Cad. Gelin Alayi Sok. No:5/A
Çınar Lokantası,5444542,Numunebağ Cad. Çınar Sok. No:21 Bayrampaşa Merkez
Sena Lokantası,5315581,Şeyh Resmi Mah. Fevzi Paşa Cad. Başhoca Sok. No:53 Fatih
Çoruh Lokantası,5070294,Bağcılar Cad. Rehber Sok. No:2 Bahçelievler Merkez
Tadim Doner ve Yemek Salonu,5406095,Besyol Mah. Birlik Cad. No:16
Oasis Restoran,6614707,Bakirkoy Sahil Yolu Galleria Alisveris Merkezi D:351
