isim,tel,adres
Meşhur Adıyaman Çiğ Köftecisi Ömer Usta,3493902,"Hasan Paşa Mah. Kurbağalıdere Cad. No:45/A Hasanpaşa, Kadıköy"
Bistro Restoran,4580000,Bağdat Cad. Dream Hill Hotel No:273 Maltepe
Tarihi Namlı Aksaray Köftecisi,+(90)212 529 3807,Aksaray Mah. Valide Camii Sok. No:13
Maxi Mola,4258772,"Cennet Mah. Hürriyet Cad. No:2 Küçükçekmece Merkez, Küçükçekmece"
Marmaris Büfe,2996521,"Köybaşı Cad. No:230 Yeniköy, Sarıyer"
Green Kitchen,3861788,Bağdat Cad. Tepe Göz Sok. Arpat Apt. No:3/C
Grand Ottoman Kebap,8825767,Fatih Mah. Londra Asfaltı E-5 Karayolu Muharrem Saltık İş Merkezi No:44 D:4
O kofte orhangazi'den,02165505858,Halitaga caddesi.No24/a
Gonyalı,4693580,Karaman Çiftliği Yolu No:60
Kral Çiğköfte,5929894,Ahmet Yesevi Mah. Bosna Bulv. No:56
Kral Çiğköfte,4799454,Cebeci Mah. 2480 Sok. No:50
Kral Çiğköfte,5617107,Osmangazi Mah. Osmangazi Cad. No:93/B
Lambada Burger,6248445,Sultan Murat Cad. No:61
Lane Türk,2755525,1. Gazeteciler Sitesi Keskin Kalem Sok. No:45
Laren Restaurant,4232070,Üniversite Mah. Firüzköy Bulv. No:79
Lavaşta,3214431,Çengelköy Cad. No:27
Köyüm Tandır Evi,8111958,Hürriyet Mah. Abdi İpekçi Cad. Demir Sok. No:5 D:1 Kartal
Öz Dağlayan Pide,5510022,Mandıra Cad. No:79/A
Master Chef,4553080,Atatürk Mah. Sulin Cad. Cesur Apt. No:21 D:7
Mayıs Mantı & Pizza,3632437,Kozyatağı Mah. İnönü Cad. Kent Apt. No:77/B
Esma Hanım Ev Yemekleri,3311011,Fatih Sultan Mehmet Cad. Ak Bey Sok. No:8
Ethem Antep Sofrası,4952655,İnönü Mah. Muammer Aksoy Cad. No:97
Mehmet Usta Pide ve Lahmacun Salonu,+90 212 250 75 92,Tersane Cad. Zeybek Sok. No:25/B
Etibeyaz,6946860,Merkez Mah. Çiğdem Cad. No:36/B
Melek Ev Yemekleri,3258737,Esentepe Mah. Ali Kaya Cad. Harman Sok. Call Center No:4
Memo Kebap,4858020,1. Etap Atlas Çarşısı No:2
Ünal Kebap ve Lahmacun,5237237,"Kırmasti Mah. Türbe Sok. No:23 Fatih Merkez, Fatih"
Urfa Kebap Salonu,2772380,"Fatih Sultan Mehmet Mah. Evren Paşa Cad. No:30 Etiler, Beşiktaş"
Meşhur Varna Kebapçısı,0212 593 7100 ,Merkez Mah. Fırın Sok. No:50/B
Meydan Döner & Lahmacun,5516321,Mareşal Fevzi Çakmak Cad. No:4/B
Meydan Pide & Köfte Salonu,6224774,Sarıgazi Mah. Osmangazi Cad. No:41/C
Meydan Tantuni,6406959,Altıntepsi Mah. Ferhat Paşa Çiftliği Mevki Çiftlik Cad. Ora No:14 K:2 D:R404
Mey Kebap,3388082,Fener Cad. No:92/C
Etiler Marmaris Büfe,6210136,Vatan Cad. No:67
Mi Manca,216 340 8467,İbrahim Ağa Mah. Dinlenç Sok.
Mimaroba Full İskender Kebap,0212 864 1604 ,Batıköy Mah. Colorist Evleri No:17
Etiler Marmaris Büfe,5807043,Tevfik Bey Mah. Halkalı Cad. Armoni Park Outlet Center No:132 K:2 D:78
Etiler Marmaris Büfe,4254070,Rüzgarlıbahçe Mah. Cumhuriyet Cad.
Burger King,8861511,Cumhuriyet Mah. Spotcular Carsisi G50 Sok. No:4
Sunrise Pizza,6379305,Keresteciler Sitesi Fatih Cad. Yuksel Sok. D:14
Beyzade Fasil Restaurant,8542002,120 Ada E-5 Karayolu Fesh Is Hani No:12
Pide's,3424444,Kilyos Yolu No:137
Enjoy Pizza,3243910,Emniyetevler Mah. Baturay Sok. No:39/B
Sampi,3710909,Cevizli Mah. Uskudar Cad. No:135/A
Marmaris Bufe,6314546,Ak Sanayi Sitesi 1. Kisim Aldemdag Cad. Site Yolu No:61 D:62
Kofte Agaci,4566768,Ataturk Cad. Mozaik Carsisi No:31
Marmaris Bufe,5730444,Umraniye Mah. Istasyon Cad. No:40/B
Caliente Ristorante,3461701,Ataturk Oto Sanayi Sitesi Ahi Evran Cad. Nazmi Akbaci Is Merkezi D:107-108
Pizza Pizza,4658643,Kuleli Mevki E-5 Karayolu Londra Asfaltı Airport Outlet Center K:3 D:101 Bakırköy
Aydınlar Şirin Ev Yemekleri,2190724,Vali Konağı Cad. Hacı Mansur Sok. No:7/C Şişli
Hamburger'cimm,4414841,Adnan Kahveci Bulv. No:103
Beykent Sark Sofrasi,8726249,Cumhuriyet Mah. Istanbul Cad. Beykent Carsisi D:122
Etiler Marmaris Bufe,3604746,Bagdat Cad. San Apt. No:304 D:4
Cengiz Kebap Salonu,2377392,Sehit Muhtar Mah. Turan Cad. No:152/A
VIP Iskembe Evi,4628354,Istanbul Cad. No:20/B
Maltiz Kofte,6698955,Golet Park Yasam Merkezi D:11-H
Dahill Istanbul,2274928,Yildiz Mah. Palanga Cad.
Dolunay Restaurant,4706162,Barbaros Mah. Halk Cad. Barbaros Sok. No:239
Popeyes Louisiana Kitchen,6023085,Merkez Mah. Tasocagi Cad. 212 Istanbul Power Outlet No:5 K:2
Chipstix,6875807,Altinsehir Mah. Osmanli Cad. No:103 D:B1-B2
Citir Usta Pide & Kebap,4943100,Basin Ekspres Yolu Derin Sok. No:58 K:4
Ziyade Restaurant,875 2901,Baris Mah. Hurriyet Cad. No. 215 D 1
Selvi Kalorimetre Restoran,2510329,Çelebi Hamamı Sok. No:12 Beyoğlu
Burger King,3323479,"Göksu Cad. No:1 Anadoluhisarı, Beykoz"
Cafe Damdaki Kedi,3408363,Asmadali Sok. No:2
Yediveren Kebap & Lahmacun,2488911,Sisli Etfal Hastanesi Sok. Eder Apt. No:6 D:1
Dedikodulu,2720990,"Bahçeler Sok. No:9 D:2 Gayrettepe, Beşiktaş"
Hotmeal,2766060,Eski Buyukdere Cad. Guney Plaza
Lezzet Pide,5705393,Yunus Nadi Sok. No:53/A
Scarlet Bistro,+(90)2122990077,Atadan Sk. No:12 Kalenderüstü Yeniköy
McDonald's,5103537,Kazlicesme Mah. Kennedy Sok. No:62
McDonald's,8722090,Cumhuriyet Mah. Gurpinar Yolu Keles Plaza D:11
McDonald's,4242322,Tevfik Bey Mah. Halkali Cad. ArmoniPark Outlet Center No:132 K:2 D:90
Burger King,6717177,"OSB 1. Cad. D:1 İkitelli, Başakşehir"
Little Caesars Pizza,"
",Şenlik Mah. Harman Sok. Florya İş Merkezi No:45 K:2 Bakırköy
Sen Kardesler,4342570,Inonu Mah. Bagcilar Cad. No:18
Ekin Manti,4350644,Bagcilar Cad. No:9/A
Seckin Bufe,4340112,Bakirkoy Cad. No:37
Unsal Meshur Mersin Tantunisi,6100189,Fatih Mah. Cincindere Cad.
Donerci Anteplioglu,5680849,Fatih Mah. Cincindere Cad. No:50
Karatepe Iskender Kebapcisi,4346067,Bagcilar Cad. No:69/A
Orta Bistro,+(90)212 258 77 88,Mecidiye mah. Yelkovan sokak no/5 Ortaköy - Beşiktaş
Tarantula Pub,+(90)2164182246,Guneslibahce Sokak No:51 Kadikoy
Kral Durumcu,5696348,Fatih Mah. Cincindere Cad. No:128/B
Pera Pilav,2449162,Tarlabasi Bulv. No:57/A
Besmec,4335452,Istanbul Cad. No:4
Aciktim Doner Kebap Lahmacun Salonu,5083356,Cincindere Cad. No:115 D:2
Sanli Doner,5684145,Cincindere Cad. No:125/B
Cafe Mengen,5660212,Dr. Erkin Bey Cad. Arslan Apt. No:27/F
Ocakbasi Piis-Tii,2138980,19 Mayis Cad. No:32 D:5
Efes Lahmacun Firini,2502128,Sakizagaci Cad. No:79
Ince Durum & Kebap Evi,2663630,Fulya Mah. Ogretmen Hasim Ceken Cad. No:9/B
Babacan Kebap Döner,4845785,Yunus Emre Mah. Veysel Karani Cad. No:120 Sancaktepe
Cakir Restaurant,4331946,Sancaktepe Mah. Carsi Cad. No:49/A
Kofteci Idris Baba,3734939,Bayar Cad. No:52/C
Dennis Birahıem,3866777,Bağdat Cad. İskele Sok. No:18 D:9 Kadıköy
Etiler Marmaris Büfe,4503551,Cafer Ağa Mah. Bahariye Cad. Nail Bey Sok. No:10 Kadıköy
Nefis Ev Ürünleri,8733947,Büyükşehir Mah. Şenemekevler Sitesi No:27/B Beylikdüzü
Seyidoğlu A'la Restaurant Cafe,+90 532 213 2567,Fevzi Paşa Caddesi
Pizza Mizza,3880074,Ali Nihat Tarlan Cad. Kuru Kuyu Sok. Altas Apt. No:10/B
Merkez Konya Mevlana,212 434 00 42,Baglar Caddesi Ikbak Sokak No16/A
Avsar Sofrasi,3725262,Bayar Cad. D:111/A-B
Mehmet Usta Samsun Pide,3722612,Bayar Cad. Paker Sitesi No:89/A
Safa Doner,5628840,Osmangazi Cad. No:16/B
Ali Usta Pilavcisi,6116688,Dag Yolu Mah. Osmangazi Cad. No:16/A
Yore Cigkofte,3617782,Bayar Cad. No:60
Sucuoglari Borek,6127791,Nisanca Mah. Pasmakci Cayiri Cad. No:57
Kocatepe Cafe & Restaurant,5070781,Eski Londra Asfalti M1 Meydan Alisveris Merkezi No:5 K:1 D:21
Gul Kofte Doner Salonu,5014228,Defterdar Mah. Otakcilar Cad. No:15/B
Efe Balik,6622215,Rihtim Cad. No:20/B
Wan-Na,3531180,Buyukdere Cad. Kanyon Alisveris Merkezi No:185 K:Teras
Bizim Donerci,4620308,Sancaktepe Mah. Osman Gazi Cad. No:5
Su'dan Restaurant,2012255,Kale Cad. No:59
Eyvan Tasfirin Kebap ve Lahmacun,3904737,Aydinli Yolu
Hanimeli Gozleme Evi,4320066,Yuzyil Mah. Kisla Cad. No:32
Midye Dolma Keyfi,3457072,Kalamis Fener Cad. No:94
Meşhur Köfteci Hüseyin Usta,2531526,"Arapcami Mah. Fütühat Sok. No:8 D:1 Arapcami, Beyoğlu"
Bereket Gozleme ve Manti Evi,6147752,Hazreti Halit Bulv. No:5
Bulvar Bufe,6747385,Dugmeciler Mah. Yeni Yol Bulv. No:85
Sur Restoran & Cafe,5460937,Kazlıçeşme Mah. Belgrad Kapı Yolu No:7 Zeytinburnu
Kebapsan Iskender,5445312,Nisanca Mah. Eyup Sultan Bulv. No:106
Gümüşkaya Et Lokantası,6329541,"Güven Sanayi Sitesi T Blok D:19 İnkılap, Ümraniye"
Komur Durum,5631088,Fahri Koruturk Cad. No:79
Yuksel Kofte&Yemek Salonu,5676072,Eyup Bulv. Saray Apt. No:41 D:2
Simsir Bufe,5782162,Halit Pasa Cad. No:34
Se-ta Bufe,4183297,Hazreti Halit Bulv. Elmasoglu Is Merkezi D:39/E
Haci Kerimogullari,5329121,Akdeniz Cad. Pinar Apt. No:19
Haci Kerimogullari,6740899,Topcular Mah. Emiroglu Sanayi Sitesi Rami Kisla Cad. No:13 D:3
Haci Kerimogullari,6740899,Emiroglu Sanayi Sitesi Rami Kisla Cad. No: 13 D: 3
Haci Kerimogullari,6169360,Turan Cad. No:30
Haci Kerimogullari,5672998,Demirkapi Cad. Sayac Han Is Merkezi A Blok No:5 D:12
Erol Usta,5633881,Fahri Koruturk Cad. No:8
Sultanahmet Kofte Time,5640904,Halit Pasa Cad. No:4/A
Sultanahmet Kofte Time,6471250,Fevzi Cakmak Mah. 1107 Sok. No:6
Bizim Doner,4292570,Yuzyil Mah. Barbaros Cad. 581 Sok. No:60
Baba Sofrasi,6296379,Oruc Reis Mah. Barbaros Cad. No:272
Aksa Kardesler Kebap Salonu,4302924,Oruc Reis Mah. Barbaros Cad. 551 Sok. No:2
Tatlim Kebap & Doner Salonu,4308207,Oruc Reis Mah. Barbaros Cad. 543. Sok. No:2
WienerWald,4727575,Atasehir 2. Etap 5. Cad. Atakent Happy Center D:4
WienerWald,3806969,Bostanci Mah. Semsettin Gunaltay Cad. Dostlar Apt. No:41
WienerWald,3383535,Halitaga Cad. No:7
Nemrut Et Lokantası,2496811,İstiklal Cad. Büyük Parmak Kapı Sok. No:9 Taksim
Centat Cig Kofte,5203739,Esenevler Mah. Yunus Emre Cad. No:13/B
Ergene Uzunkopru Koftecisi,2815556,Nispetiye Cad. No:26/B
Gaziantep Eyup Sultan Sofrasi,6286199,Yuzyil Mah. Barbaros Cad. 27. Sok. No:2/B
Meshur Pilavci Kemal Usta,4320991,Yuzyil Mah. Barbaros Cad. No:2/A
Centat Cig Kofte,4611666,Cengiz Topel Cad. No:3/A
Gunaydin Kofte & Doner,4480430,Icerenkoy Mah. Eski Geneto Arsasi CarrefourSA K:2 D:FC7
Appetite,3460448,Maslak Mah. G45 Ahi Evren Cad. Dogus Power Center No:4 K:Zemin
Yufka Durum Isleri,3115000,Emniyettepe Mah. Bilgi Universitesi Santral Kampusu Kazim Karabekir Cad. No:2 D:6
Hazal Ocakbasi,2951956,Gulen Sok. No:25/A
Dostlar Bufe,6297034,Yuzyil Mah. Barbaros Cad. 53. Sok. No:2
Istavrit Cafe,2457774,Istiklal Cad. No:143
Yeni Marmaris Bufe Doner,4292883,Yuzyil Mah. Barbaros Cad. No:22/B
Pendik Donercisi,6294141,Oruc Reis Mah. Barbaros Cad. No:16
Chinese Express,4674091,Bagdat Cad. No:298 D:3
Pasta Lab,2870412,Nispetiye Cad. Bal Sok. No:21
Kebapci Baran,4294051,Yuzyil Mah. Barbaros Cad. No:160/A
Greenwich Restaurant,3450315,Eski Buyuk Dere Cad. Park Plaza No:22 D:3
Sushico,5262701,Fatih Sultan Mehmet Mah. Balkan Cad. M1 Meydan Alisveris Merkezi No:64
Manti Keyfi,5532511,Bahcelievler Sapagi Omur Plaza
Manti Keyfi,2112151,Fulya Mah. Pehlivan Sok. No:13/A
Sirri Usta Cigkofte,6295864,Yuzyil Mah. Barbaros Cad. 11. Sok. No:2
Ezgim Cafe & Restaurant,2363575,Yildiz Mah. Yildiz Cad. No:17
Denizler Bufe,5888790,Kurtkoy Mah. Istanbul Sabiha Gokcen Uluslararasi Havalimani
Oz Uzmanlar Kebap,3955016,Yayla Mah. Fevzi Cakmak Cad. No:83
Sehrazat Restaurant,2270060,Muallim Naci Cad. No:51/A
Antepli Haci Usta,5775873,Kayisdag Cad. Zafer Sok. No:4/A
Elazig Cig Koftecisi Muco Usta,3551187,Semsettin Gunaltay Cad. No:165/A
Sahane Pilavhane,2760603,Ataturk Oto Sanayi Sitesi 2. Kisim 5. Sok. D:109
Sempatik Cafe,2112151,Fulya Mah. Pehlivan Sok. No:13/A
Mr. Kumpir,6699077,Doga Park Cad. Goletpark Alisveris Merkezi No:11 D:4
260 Pizza & Tavuk,"
",Nuhkuyusu Cad. No:18/C
Eskidji Suites,2960044,Abide-i Hurriyet Cad. Gecit Sok. No:8
Yuka Bufe,6904243,Universite Mah. E-5 Karayolu No:106
Yufka,6618919,7-8. Kisim Deniz Sitesi 18. Blok No:137
Izmir Midye Dolmasi Midyesel,3279992,Acibadem Cad. No:41
Sampi,5900444,Bostanci Yolu Cad. Keyap Carsisi No:53 D:B-2
Marine Bufe,3221338,Ruzgarlibahce Mah. Cumhuriyet Cad. No:31/B
Dim Sum,3457048,Pinar Mah. Istinye Bayiri Cad. IstinyePark Alisveris Merkezi K:1 D:510
Miss Tantuni,8769940,Beylikduzu Mah. Acelya Cad. No:121
Bursa Kebap Evi,4784000,Bagdat Cad. No:364
Kral Mersin Sofrasi,3388085,Osmanaga Mah. Murver Cicegi Sok. No:10 D:7
Antakyali,2783116,Gul Sok. No:2 D:5
Rasim Kofte,2311729,Vali Konagi Cad. No:105
Doyum Kebap,4115341,Bagdat Cad. Nihat Kiziltan Sok. No:348 D:27
Cig Kofteci Ahmet Aybak,4850592,OSB Corapcilar ve Trikocular Sanayi Sitesi H Blok D:11
Murat İskender,3585080,Ethem Efendi Cad. Hamam Sok. No:35/D Kadıköy
Vizyon Bufe,2161061,19 Mayis Mah. 19 Mayis Cad. No:36 D:2
Tadim Kebap,2231794,Baglar Mevki Havuzlu Bostan Cad. No:37-39
Komagene,3485878,Dr. Fahrettin Kerim Gökay Cad. No:35/B Kadıköy
Doner Bank,+90 212 571 4049,İstanbul Cad. No:26
Komagene,5320566,Mimar Sinan Mah. Atlas Sok. No:26 Üsküdar Merkez
Sila Ev Yemekleri,6697523,Atrium Carsisi K:4 D:402
Komagene,6956767,Marmara Cad. Şamlı Sok. No:27 D:24 Avcılar Merkez
Komagene,8768393,Merkez Mah. Hürriyet Bulv. No:189 Beylikdüzü
Komagene,4373101,Şehir Parkı Cad. 12. Sok. Forum İstanbul K:2 Bayrampaşa
Ayların Evi,+(90)5379668508,Yesilkent Mah. Nazim Hikmet Bulvari innovia2 Dis Ust M Carsi
Izmir Midye Dolmasi Midyesel,2721133,Selahattin Pinar Cad. Dost Pasaji No:27
Hemşin Sofrası,2762834,Atatürk Oto Sanayi Sitesi 2. Kısım 15. Sok. D:471 Şişli
Pita Döner,8731073,Büyükşehir Mah. Cumhuriyet Cad. Atatürk Bulv. Ekinoks Alışveriş Merkezi No:1 K:Zemin Beylikdüzü
Köftexpress,8731073,Büyükşehir Mah. Cumhuriyet Cad. Atatürk Bulv. Ekinoks Alışveriş Merkezi No:1 K:Zemin D:ZM/16-B Beylikdüzü
Keyf-i Cay Evi,2125514900,Cayirbasi Sokagi & Hisar Sokagi / Mahmutbey 8. Sokagi
Anadolu Kebap,3210538,Fatih Sultan Mehmet Cad. No:2
Antep Sofrasi,5321609,Hocauveyz Mah. Aksemsettin Cad. No:3
As Manti Evi,3272663,Visnezade Mah. Catlakcesme Sok. No:7/B
Alto Pizza,2464333,Samanyolu Sok. No:112
Antioch Food Instutute,4147030,Kurbagali Dere Cad. No:28
Antic Bahane Restaurant,3305752,Riza Pasa Cikmazi No:8/A
Antik Art Manti Cafe,2778880,Resitpasa Mah. Tuncay Artun Cad. No:23
212 Fahrenheit Restaurant,4953646,Atakent Mah. Soyak Olympiakent Sitesi No:9
Bizim Firin,2684449,4. Levent Selvili Sok. 13. Blok No:14
Lezzet Büfe,5495108,OSB Esot Sanayi Sitesi J Blok D:1 Başakşehir
Akpinar Kofte,3461088,Ataturk Oto Sanayi Sitesi 1. Kisim 42. Sok. D:160
Mavi Köşk Lokanta,5497708,OSB Dolapdere Sanayi Sitesi 24. Ada D:9 Başakşehir
Bahr-i Siyah Restaurant,5727254,Karsli Ahmet Cad. No:52
1996 Zag Kebap,6323260,Inkiliap Mah. Kucuksu Cad. Pirireis Sok. Mert Apt. No:2 D:1/A
Antepeli,3235210,Resitpasa Mah. Posta Yolu Cad. No:4
A. Uysal Gurme Restaurant,4557513,Atasehir Bulv. Ata 3/4 D:50
101 Alem-i Ati Ev Yemekleri,2932101,Akyol Cad. No:37/A
Karadeniz Mutfağı,4959179,Muratreis Mah. Alleme Cad. No:105 Üsküdar
Akkoc Kebap,5776087,Icerenkoy Mah. Karaman Ciftlik Yolu No:41/B
Bosnak Mutfagi,3479112,Bulent Tarcan Cad. No:6 D:12
Badem Tantuni,3464219,Acibadem Mah. Acibadem Cad. Cakmak Sitesi S Blok No:2
Antep Sofrasi,5021145,Mustafa Kemal Pasa Cad. No:125
Pizza Friendly,5060101,Izzettin Calislar Cad. No:26
Avrasya Durum Evi,3262033,Mehmet Afkan Sok. No:67
Annem Manti & Ev Yemekleri,3462566,Ataturk Oto Sanayi Sitesi D:23
Antepli Ali Haydar Turkmen,5742658,Sevketiye Mah. Irfaniye Sok. No:22
Konak Et Lokantası,4662656,Osmaniye Mah. Fabrikalar Cad. Adalet Sok. No:3/A Bakırköy
Elibol Pide&Kebap,5483757,Atakent Mah. Hurriyet Cad. Inci Sok. Alarko Bloklari No:3
Asli Gaziantep Tas Firin,2893182,Ataturk Cad. No:63
Ban Ban,2696871,Atalar Cad. No:36/A
%100 Doner Limos Cafe,4566600,Atasehir Bulv. Ata 3/5 Blok No:1/C
Köfteci Ramiz,6641060,İstiklal Sok. Optimum Outlet ve Eğlence Merkezi No:10/4 K:3 D:145 Ataşehir
Arsamiea Cigkofte,2889894,Gulbag Cad. No:9/C
Erdoganlar Durum,5688887,Davutpasa Mah. Davut Pasa Cad. No:1/C
Caca Cafe,2252535,Abidei Hurriyet Cad. No:147/B
Yore Ev Yemekleri,3275231,Muradiye Mah. Muradiye Deresi Sok. No:53/A
Bizim Cigerci & Kofteci,3460440,Ataturk Ota Sanayi Sitesi Nazmi Akbaci Is Merkezi No:143
Etiler Marmaris Bufe,5734403,Istasyon Cad. No:18
%100 Lezzetly,3232381,Resitpasa Mah. Resit Pasa Cad. Murat Sok. No:9
Baron Bufe,4500867,Recep Peker Cad. No:20
Emircan Kebap,6390697,Mimar Sinan Cad. Emek Sok. No:3
Cinar Kofte,3384050,Sogutlucesme Cad. Bayramyeri Sok. No:12
Bizim Urfam Kebap,2995212,Ferahevler Mah. Adnan Kahveci Cad. Aydin Sok. No:10/A
Baron,3518900,Nispetiye Cad. Selcuklular Sok. No:15/A
Wishbone Chicken Bistro,2585654,Ortabahce Cad. Sinan Pasa Kopru Sok. No:3
Etiler Marmaris Bufe,5045416,Calislar Cad. No:37
Mantar Kafe,4496471,"Kadife Sok. No:6 Caferağa, Kadıköy"
Burgy's,8554520,Yavuz Sultan Selim Bulv. Paradise Alisveris Merkezi No:26 D:79
Bufe Marmaris Gusto,5601399,7-8. Kisim Ata Sitesi C4 Blok G Kapisi D:49
Doga Kebap,8721996,Beylikduzu Mah. Atrium Carsisi D:12
Blackjack Pizza,"
",Ambarlidere Sok. No:17/A
Etiler Marmaris Bufe,6952833,Merkez Mah. Harmanyeri Sok. No:6/A
Elmas Bufe,2650433,Nispetiye Mah. Nispetiye Cad. Esen Apt. No:116 D:3
Cafe Tik Tak,4889331,Kordonboyu Mah. Ankara Cad. No:31
Acibadem Kokorec,3402452,Acibadem Cad. Gozde Apt. No:159/C
Gaziantepli Yorem Sofrasi,3176376,Ayazma Cad. No:49
Hanedan Kebap Durum ve Ev Yemekleri,2730803,Kervangecmez Sok. No:11 D:2
Zeyno Bufe,2600622,Ihlamur Cad. Hattat Tahsin Sok. No:26/B
Ev Isi,2808383,Caliskan Sok. No:7/A
Bread's,"
",Büyükdere Cad. Eczacı Ali Kaya Sok. Polcenter Alışveriş Merkezi No:4 K:Zemin D:35 Beşiktaş
Burger Time,4173175,Merkez Mah. Mektep Cad. No:22/A
Burger Tadim,2787552,Inonu Cad. No:46/B
Huzur Kebap,2235401,Salci Kir Cad. No:15
Guney Kebap,5551250,Haznedar Mah. Posta Cad. No:8/B
Yasmin Cafe,3800800,Emin Ali Pasa Cad. Bostan Tarik Sok. No:10/C
Aspet Express Bufe,3868880,Semsettin Gunaltay Cad. No:169 D:2
Kameriye Cafe & Restaurant,4697976,Kayisdagi Cad. Karaman Ciftlik Yolu Parlak Plaza
Cafe Sera,3395986,Validebag Kalfa Cesme Sok. No:4
Gossip Cafe,4713631,Baykal Sok. No:5
Caffe Verde Exclusive,4717926,Kayisdagi Cad. Fatih Sok. No:3
Karadeniz Sofrası,6713407,OSB Demirciler Sanayi Sitesi E Blok D:390 Başakşehir
Hammburger,3255230,Bacadibi Mah. Talat Pasa Cad. No:14
Cizbiz Kofte,4852171,Basaksehir Mah. Basaksehir 1. Etap Kiptas Carsisi D:17
Öz Sandıkçılar Balıkçılık,3027562,Ethem Efendi Cad. Hamam Sok. No:2 Kadıköy
Aydınlar Kebap,3624077,"Hilmi Paşa Cad. No:1 Kozyatağı, Kadıköy"
Hanedan Sofrasi,5593334,8. Kisim Baris Sitesi C1 Blok D:48
Teras Mantı Evi,3278840,Dikilitaş Mah. Yeşil Çimen Cad. Ak Plaza No:13 Beşiktaş
Eskina Balik,3256767,Acibadem Cad. No:170
Citir Usta,4884410,OSB Ataturk Bulv. Deposite Outlet Merkezi K:Giris D:10-11
Aslar Iskender Kebapcisi,2794499,Ibrahim Karaoglanoglu Cad. No:117/A
Cizbiz Kofte,6080700,Bahcesehir 2. Kisim Mah. Suzer Bulv. KC Sehr-i Bahce Alisveris Merkezi K:2 D:67
Konya Etli Ekmek,2892226,Alemdag Cad. No:96/A
İstasyon,3678265,Rıfkı Tonsir Cad. No:5 D:1 Maltepe
Yenisu Pide Salonu,3633745,Ethem Efendi Cad. No:79/D Kadıköy
Duran Sandwiches,6080240,Citkusu Cad. Bahcesehir Fen Teknik Lisesi No:8
Cadde Burger,5728828,Incirli Cad. Kibris Sok. No:2 D:1
Cagdas Bursa Iskender,2475194,Duatepe Mah. Cobanoglu Sok. No:47
Elvani Pide & Manti,4872831,Ak Semsettin Mah. Esref Bitlis Bulv. No:28 D:8
Eyvan Plus Restaurant,6426770,Mimar Sinan Cad. No:162
Bizim Tas Firin,3258515,Direkli Carsisi No:3
Butik Kebap,2606230,Yildiz Mah. Ihlamur Yildiz Cad. No:17
Hünkar 25 Lokantası,5756782,Bostancı Oto Sanayi Sitesi İnci Çıkmazı Sok. D:9 Ataşehir
Damak Ev Yemekleri,2247387,Albay Sadri Alantar Sok. No:13/C
Donerci Hayri,3134099,Ikbal Cad. Civan Sok. No:78
Koru Salon,3421992,Acarlar Bogazici Koru Evleri Coliseum Active Binasi
Elit Mardin Sofrasi,2475741,Elmadag Cad. No:2/B
Marmaris Bufe,6691020,Selale Evleri Teras Garden Sitesi No:15
Kestane,3225746,Belediye Cad. Kemerlife Carsi No:26 K:2 D:217
Mevlana Etli Ekmek,5178468,Kizilay Bulv. No:78
Epicure Yaratici Salata & Makarna,2847542,Ali Kaya Sok. No:4 D:25
Ekizler Gorele Pide,216 318.60.42,Guzeltepe Mah. Kucuk Namazgah Cad. No:48
Hayal Sofrasi,2839833,Bacadibi Sok. No:3/A
Musa Iskender Kebap,2893582,Ataturk Cad. No:29
Etiler Marmaris Bufe,3464414,Nazmi Akbaci Ticaret Merkezi D Blok D:33
Efsuni Ev Yemekleri,5853525,Koca Mustafa Pasa Cad. No:118/A
Fontaana Kafe & Restoran,5273292,Balkan Cad. No:8
Gumuskapi Iskender,6466036,Atisalani Cad. No:13/A
Kaya Kumru,5013773,Demirkapi Cad. Karagoz Is Hani No:3/D
Etiler Marmaris Bufe,6425851,Adnan Menderes Cad. No:26/A
Gaziantepli Hacibayram,5772620,Kayisdagi Cad. No:121
Birtat Tantuni,4675666,Semsettin Gunaltay Cad. No:212/C
Natural Sofra,2499779,Kemankeş Mah. Mumhane Cad. No:15 Beyoğlu
Izhar Restaurant,6372210,Keresteciler Sitesi Fatih Cad. Karadal Sok. D:2
Karisik Pizza,3246590,4. Levent Yeniceri Sok. No:26
Istekli Kebap & Lahmacun,3492360,Acibadem Mah. Asaf Bey Sok. No:8/B
Gaziantep Nazenin Kebap,6442727,Izzettin Calislar Cad. No:30
Kolej Bufe,4850168,Acarlar Mah. 9. Cad. Arda Is Merkezi D:T-5
Mamma Mia Pizza,2026860,Garanti Koza Carsisi B Blok D:7/S
Konya'dan Tandir Etli Ekmek,5852121,Altimermer Cad. No:7/B
Marmaris Bufe,3227411,Tan Sok. Corner Sitesi D:2
Anatolia Manti ve Cig Borek,4569365,38. Ada Ata Blok No:3 D:2
Cafe Likapa,2712328,Zumrutevler Sahinci Sok. No:1
Koy Durum,6426256,Mimar Sinan Mah. Aydin Menderes Cad. No:22
Mensur Bafra Pide,3563605,Yeni Yol Hamam Sok. No:18
Lapi Lahmacun,4662206,Cevizli Mah. Hamdi Pasa Mektebi Sok. No:30
Lezziz Kofte & Piyaz,4734363,Toros Cad. No:14
Bahceli Iskender Kebapcisi,6447078,Bahcelievler Mah. Ferit Selim Pasa Cad. No:60
Konya'dan Etli Ekmek,8542828,Beylikduzu Mah. Cumhuriyet Cad. 1997 Sok. Park Konutlari B Blok No:3/A
Flu Garden Restaurant,2245001,Mesrutiyet Mah. Akkirman Sok. No:37
Arsamiea Etsiz Cig Kofte,2665253,Fulya Mah. Mehmetcik Cad. Emiroglu Sok. No:20/A
Ozen Kebap,5737486,Kayisdagi Yolu Cad. No:3/B
Kutu Doner,5808529,Yenisehir Mah. Viyana Sok. No:24
Komagene,4633513,Kocayol Cad. Kozyatagi Sok. Sezgin Apt. No:12/B
Lezzet Restaurant,2663557,Dr. Ismet Ozturk Cad. No:20/A
Match Cafe,3464419,Nazmi Akbaci Ticaret Merkezi No:19/D
Atasehir Kokorec,4569339,36 Ada Ata Blok No:2 D:22
Marin Cafe Pizzeria,5597733,7-8. Kisim Ata Sitesi Deniz 8 Blok D:57
Kebapcim Halilbey,5555122,Adnan Kahveci Bulv. No:57/A
Metro Pub,2161099,Buyukdere Cad. No:120
Cira Cig Kofte,5728888,Incirli Cad. Asiller Sok. No:2
Meshur Tekirdag Koftecisi Ali,2430443,Siraselviler Cad. Soganci Sok. No:9
Sef Makbul,2756699,Balmumcu Mah. Barbaros Bulv. Bayindir Cikmazi No:138/A
Moston Cafe,3523717,Bagdat Cad. No:343/B
Etiler Marmaris Bufe,4422833,Adnan Kahveci Bulv. No:38/A
Gulogullari,4419123,Adnan Kahveci Bulv. Camlik Cad. No:143
Orkide Cafe,5753898,Karsli Ahmet Cad. Birlik Pasaji No:25 D:7
Burgy's,6718824,OSB Ataturk Bulv. Deposite Outlet Merkezi K:Zemin
Izmir Midye Dolmasi Midyesel,4678006,Ataturk Cad. No:27
Enna Cafe & Restaurant,2292102,Adnankahveci Mah. Gurpinar Yolu Keles Plaza No:11 D:6
Biyer Akcaabat Kofte ve Pide,8534488,Cumhuriyet Mah. Cumhuriyet Cad. Beypalas Sitesi No:B1/A
Nostalji Cafe & Restaurant,2714508,Kumsal Arkasi Sok. No:7
Mavi Yunus Fish Restaurant,4567488,38. Ada 3/2 Ata Blok No:2
Nergis Kebap,2214279,Kestanelik Sok. No:13 D:1
Iskenderci,4163936,Ali Nihat Tarlan Cad. No:15
Orkinos Balik,2646852,Ortabayir Mah. Talat Pasa Cad. No:6
Koz Kebap,5592666,Atakoy 8. Kisim C4 Blok D:B-10
Site Balık,2671687,Mevlüt Pehlivan Cad. No:9 Şişli
Fred's Chicken Rotisserie,5093509,Resit Pasa Cad. Fatih Sok. Omer Okutan Is Merkezi No:17
Fisho,3801910,Buyukdere Cad. Istanbul Cevahir Alisveris ve Eglence Merkezi No:22 K:6 D:A613
Istanbul Koftecisi,6719807,OSB Turgut Ozal Cad. D:107
Marmaris Bufe,6884848,Barbaros Mah. Dereboyu Cad. Fulya Sok. Uphill Court No:1/B
Gaziantep Eyup Sultan Sofrasi,5842103,Ilyas Bey Cad. No:68
Has Doydum,3158570,Libadiye Cad. No:105
China Wok,2993399,Koybasi Cad. No:84/A
Gulce Ev Yemekleri,3550225,Inonu Cad. Camli Park Sok. No:5/C
Ozveren Kebap,2271865,Abbasaga Mah. Jandarma Mektebi Sok. No:12/A
Gaziantep Bilal Kebap,2402959,Huzur Sok. No:15/A
Ipar Pizza & Kebap,3525073,Zeytinoglu Cad. No:111/B
Gorkemli Doner,3870068,Petrol Is Mah. Atalar Cad. No:140
Santral Cafe & Restaurant,5437638,Yeni Incirli Yolu Sok. No:15 D:2
Guney Mersin Tantuni,3625266,Emin Ali Pasa Cad. No:117 D:3
Selcuk Usta Ev Yemekleri & Mangal,3522198,Talat Pasa Cad. No:8/A
Selimiye Balikcisi,3919487,Kisla Cad. No:18
Sila Tantuni,4502467,Fahrettin Kerim Gokay Cad. No:88 D:3
Soli Tantuni,3521133,Cevher Sok. No:7/A
Ilyas Usta Kebap & Pide,6699130,Basaksehir Mah. Pazar Turk Mevki
Park Pizza & Pide,5521721,Zafer Mah. Calislar Sok. No:19 D:6
Sirin Urfa Lahmacun & Kebap,2534520,Fetihtepe Mah. Ozgul Sok. No:73/A
The Other House,00902123439555,Çorbacı Çeşmesi Sk. No:33
Salas Balik,3046399,Nisantepe Mah. Turgut Ozal Bulv. No:172
San Pide & Lahmacun,6498151,Abdi Ipekci Cad. No:13
Burger Borsasi,2575603,Hisarustu Mah. Nispetiye Cad. No:123/A
Sampi,4749999,Mahir Iz Cad. No:5 D:16
Lamal Cafe & Restaurant,5050517,Calislar Cad. No:17/A
Sofra Keyfi Restaurant & Cafe,5720676,Kucukbakkalkoy Yolu No:55/C
Tadim Bufe'm,5516263,Maresal Fevzi Cakmak Cad. 3. Sok. No:5 D:3
Umut Bursa Iskender,4417313,Eski Londra Asfalti No:60
Kizilirmak Bafra Pide Salonu,2923287,Rihtim Cad. No:46
Encoy Cafe ve Restaurant,4504846,Resit Pasa Sok. Onol Apt. No:8/B
Tavukcuzade,5893010,Denizabdal Mah. Basvekil Cad. No:39/A
Yayla Sark Sofrasi,5569192,Deli Huseyin Pasa Cad. Elvan Sok. No:1/A
Taze Balik,2774050,Fatih Sultan Mehmet Mah. Bilgi Sok. No:5/B
Mas & More,3462308,Ahi Evran Cad. Nazmi Akbaci Is Merkezi No:17
Turkwich Cafe,2635200,Hisarustu Mevki Cami Sok. No:12
Takko Fast Food,3611313,Kozyatagi Mah. Ankara Asfalti Demirmen Yolu Sok. No:13/A
Etiler Marmaris Bufe,8714649,Cumhuriyet Mah. Gurpinar Yolu Keles Plaza No:11 D:2
Simsek Pide & Doner,3386734,Kusdili Cad. No:35
